,product,narrative
107,credit_reporting,"isim yanlış bilgi gördüğüm için kredi raporu değiştirmeye çalışıyorum, adres, iş bilgileri, ilişkiye ait bilgiler, yakın iş, gerçekten yetenekli, kötü etki, kredi raporu, yanlış bilgi iddiası, isim, adres, iş bilgisi değiştirme , derhal kaldırılmalıdır."
108,credit_reporting,ekli ilk özel yazılı başvuru qwr öğesi gerekli portföy seç hizmeti kanıtlamak istikrarlı ipotek ödemesi makbuz olmadan tahsil etmek spss ayakta sps kredi raporu yanlış mazeret gizliliğin ihlali fcra sps güvenli hesap aracılığıyla bağış toplama güvenli özel ipotek sps müşteri incelemeleri ana iş hedefi hileli haciz eve el koyma
109,credit_reporting,Gerçek kimlik hırsızlığı kurbanı olarak kimlik hırsızlığı iki bilgi almaya çalıştı dolandırıcılık isabet silindi kredi raporu görünüyor işlem yapıldı sonuç kimlik hırsızlığı da kurban veri ihlali birden fazla hesap kredi raporu mayın listelenmiş çok kredi rapor gönderildi ftc polis raporu destek talebi burada ftc rapor polis raporu numarası ive geçen yıl experian aradı 4. satır arandı hesap bulunamadı tarihi kullanarak doğrula doğum onayı experian rapor numarası hesap adı hesap numarası tarih açılan hesap adı hesap numarası sahte borç kredi başvurusunda bulunmayı hatta ilk defa kredi kartı almayı deneyenleri engelliyor kredi oluştur bil sonraki adım başla çözüme git durum finansal duygusal strese neden oldu en kötü kısmı işe dayalı bilgi sağlanmadı inkar raporu tion sorunu MKK raporlarında olumsuz eylem dezenformasyon sonucu dolandırıcılık mağduru hırsızlık yeri dolandırıcılık uyarısı kredi raporu ayrıca ilçe şerif ofisine şikayette bulunun polis raporunu yükledim opya FTC raporu yardımlarınız için çok teşekkür ederim
110,credit_reporting,gerçek kimlik hırsızlığı mağduru kimlik hırsızlığı kimlik hırsızlığı ile ilgili bilgiler listede görünüyor Kredi raporu kimlik numarası ile ilgili işlemin sonucu lütfen bloke edin bilgi raporu equifax veri ihlali üyesine dosyalanmış başvuru sırasıyla kredi numarasına açık girişim hesap adı hesap numarası hesap hesap numarası hesap adı hesap numarası hesap numarası hesap numarası hesap numarası hesap numarası hesap numarası
111,mortgages_and_loans,kapalı ipotek dovenmuhle ipotek hesabında ödenen önemli bakiye iade için bekliyordu Çek hiç gelmedi dovenmuhle aradı çekin gönderileceğini söyledi normal işlem hafta iş günü nakliye çağrı bekliyor iade çeki asla gönderilemiyor yeni adres gönderilebilir telefon e-posta e-posta imzalı belge güncelleme istiyor posta adresi bir gün beklemesi istendi geri arama doğrulandı geceyi geçirmek istedi kabul edildi başlangıçta arandı dedi e-posta bir daha asla alınmadı iki farklı e-posta adresi nihayet bulundu dedi ilk denemek istedi geceyi geçirdi sözcü menajerin onaya ihtiyacı olduğunu söyledi menajeri aradı aradı geri aradı çek geri aradığı hafta içinde işlenecek bir mesaj bıraktı yöneticiden geri aradığı gece için bir dakika geç kalmasını istedi hepsi sor yönetici bir dakika gecikme otomatik arama devre dışı waaaayyyy ertesi gün pencere geri garanti tam işlemi yasadışı olarak para tutmak için kabul edilemez
112,mortgages_and_loans,başarılı bir şekilde ilk konut kredisi başvurusunu yeniden finanse etmek için fargo devam et şimdi başvur geri ödendi ön uygulandı araştırma kredisi tamamlandı nihai karar onaylandı gelecek hafta kredi borç geliri nedeniyle reddedildi en iyi kredi cari yılı azaltacak ipotek yılı p l daha yüksek geliri yansıtıyor cari nisan azalacak için teşekkürler Yardım
113,mortgages_and_loans,ev ipotek alındı ​​satıldı kredi şirket hizmet boşanmış hizmet üyesi yıllar evlilik boşanma yoluyla boşandı ev boşanma nafakası alındı ​​tam birinci yıl evli olmayan anne arandı müdahale işveren birleşince desteklenmiyor ani kayıp nafaka ödemesi nafaka sol geri ödeme zorluk ipotek peşinat ödemesi düştü mücadele karşılayabilir ev onarımı kombine aylık emlak gideri dosyalanmış tapu ikame ayrıcalığı duygusal olarak sevilen evi fiziksel olarak şimdi doğru arayabiliyor haciz kaybedilen iş tamamlandı kağıt nişan isim satışı ile yaklaşılabilir kredi hizmetleri şirket noktası kapalı derin komisyoncu komisyoncu her şeyi durdurabileceğini söyledi kısa satış her şeyin icabına bakardı komisyoncu benzersiz iletişimle ilgilenen hizmet veren oldu emlak ağı şirket ünvanı kontrol ana net ay gitmek ilgilenen ayrıldı başka bir ilgilenen bulundu komisyoncu devam sorun çalışma başlık tartışma soru noktası kırık yaz hastaneye kaldırıldı ayrıca hizmet edildi piyon kağıt hastaneye yatış başladı soru komisyoncu banka eve git kardeşim adı gitmeye çalış yazmaya devam etmeye çalış ev iddia ev dosyalanmış tapu ilçe transfer sekreter üniversiteye döndü yaz öğretmenle iletişime geçildi avukat komisyoncu banka son ödeme yapıldı tam hesap kaydedildi va dedi tapu geri devredildi kredi hizmet şirketi herhangi bir hizmet şirketiyle iletişime geçebilir hizmetle iletişime geçebilir bilgi istendi evrak teslim ofisi kesin olarak bilmek istedi arandığını söyledi krediyi tamamlamak başka bir avukata yönlendirildi ayrıcalık birçok kez konuştu tedavi avukatı ortak geçen yıl bir dilek yerine getirildi her ay kredi hizmet şirketi geç ödeme bildirdi kredi zarar gördü avukat bulamıyorum istekli temsil davayı tamir etmeye çalıştı kredi mükemmel ödeme kredi kartı araba kredisi ödenmiş araba erken kapandı iki küçük borç ücreti canlı n her yerde iyi kredi memuru hala gecikmiş ödeme raporları gecikmiş ödemeler daha uzun yıllar birikiyor yine de haftada birkaç kez temas kurun kredi fikri mahvoldu yıl en kötü yıl eve gitmek haciz hatta kredi almak
114,mortgages_and_loans,emlak vergisi suçlu mahalle phh ipotek denilen bir mektup var para çek kefalet faturası hesabı dedi dağınık aradı dedi geri aradı cuma konuştu eskalasyon müdürü ilk önceliği vereceğini söyledi ilk önceliği vereceğini söyledi gerekli davayı aldım faks nüshasını aldım varsayılan vergi beyannamesinin aranabilir e-posta adı ilçe faksı bırakılabilir e-posta beyanının bir kopyasını gönder e-postayı alabilir vergi beyannamesi geri gönderilebilir aranabilir e-posta adresi vergi beyannamesi gönderilebilir bağlı aracı covid virüs güncelleme aranabilir hala oturum açabilir temsilci e-posta yoluyla güncelleme isteği gönderdi hala güncellemeye cevap
115,mortgages_and_loans,"yangın evi kurtarıldı deneme hasar sigorta şirketi hızlı gönder iyi iş kontrol penceresi erimiş hasarlı banka sahibinin müteakip kontrolü ipotek takip onaylandı kontrol tamamlandı baskı işi tamamlandı satıcı ücretli iş sigorta şirketi çek gönder ferforje çit işi le yıkıcı satıcı her zaman geç gösterir kontrol penceresi yapıldı kanıtlanmış takip edildi ofis, mevduat fonu takibi istiyor dahili hesap, birinin geri ödemeye ihtiyacı olduğu her zaman işlem yapar, özellikle zaman borcunu aileye gerekli yükü yükler, ev para ödeme zamanı takip eder emanet hesabını korur, genel giderleri koyar stresli zaman nedeni, mülk yüzdesi göz önüne alındığında, mülkün iyi bir ödeme geçmişine sahip olması"
116,mortgages_and_loans,"nihai fatura, usps aracılığıyla alınan tarih dahil olmak üzere, nihai fatura, hasar türünü ayrıntılandıran destekleyici belgelerin türünü, gerekli onarım dahil olmak üzere fotoğraflı mekanik belgeleri, onarım bildirimini, şarj belgesini, sorun gidermeyi, ekipmanın nihai sonucunu doğrular, alabileceğiniz garantiyi içerir istenen bilgiler çevrimiçi, tüketici, finans şirketi. sağlanan sorumluluk bilgileri faturayı doğrular"
117,mortgages_and_loans,"Özet citibank ödeme yapmayı imkansız hale getirir istenmeyen bakiyeyi kontrol edin teslimat adresini veya hatta geçerli bir telefon numarasını reddedin, bunun yerine gecikme ücretleri ekleyin çünkü bir şey harika görünüyor çünkü cari hesabı kontrol edin artı alınan haftayı beklemeyi deneyin, citibank'taki teslimat adresi yaklaşık kalan citibank kapalı bakiyeyi çevrimiçi kontrol edebilir bankacılık erişimi daha uzun tam tutarı onayla bakiyeyi daha uzun süre gör hesap bakiyesini gör karar ver hesabı kapat hesabı kapat aktif citibank çevrimiçi sohbet İşlev Birden fazla telefon görüşmesi nedeniyle başarısız oldu Mevcut çek bakiyesi aktarıldı Ödemeler için kredi uygulandı Temsilcinin bakiye limiti zaten ödendi Kalan bakiye önemsiz Notlar ödeme tutarının değeri cari hesap havale hesabı bakiyesi kapalı sokak ödemesi artık mevcut değil r cevaplar özel kredi departmanını takip edin hemen gerçekleştirilen doğrudan numara, lütfen satış departmanı ile tam boyutlu olarak iletişime geçin biliyorum ödemenin iletilebileceğini cevapla cevap çek fon banka hesabı da bir çek gönder lütfen özel olarak ara menü seçeneği olmadan numarayı belirt ilgili görev yürü alternatif zaman tekrar dene sonunda biri ile konuşur ama onun adını anlamıyor arama tahsilat hesabı iptal çağrı yönlendirme numarası tekrar emin olun ayrıca teyitli geç tahsilat ücreti eklendi kredi eklendi arama kayıt numarası denilen numara defalarca test edildi kilitlenme noktası Citibank küçük borçları ödemeyi neredeyse imkansız hale getiriyor ve vadesi geçmiş ücretlerin tahsilatı için ücret eklenmesi, herhangi bir fayda s. Soru, Citibank'ın sadık müşterisi, New York'tan bu yana ilk kez, Washington, DC, kırk yıl, garanti, diyelim ki, hiçbir şey, elbette, faturayı çevrimiçi ödemeye çalıştı, Citibank sitesi, cevaplar, mesaj, hesap detayları, mevcut bilgiler etkinlik hakkında, kapalı"
118,debt_collection,"""Illinois"" adlı imzalı kiralama şirketi kira sonu tahsil edilmemiş taşınma borcu, gönderilen hasar kanıtı talebi, belgeler, tahsilat, yanıt alındı, bir ay sonra bildirim alındı, fatura, tahsilat, hiç telefon alınmadı, tahsilat adlı posta toplama ajansı acente, askıda tutmaya devam etti, taşınma tarihi, emlak şirketi bildirimi."
119,debt_collection,Alacaklılar gelir tablosu sunmayı reddediyor
120,debt_collection,portföy kurtarma ortak birden fazla günlük arama yapma ikamet günlük konuşma talep edilen aramayı yok sayma isteği lütfen yardım edin zaman farklı numara arayın arayan kimliği portföyrecov teşekkür ederim
121,debt_collection,"her gün, bazen günde birkaç kez arar, bir yılın borcunu toplar, belki başkaları önemli telefon görüşmelerini bekler, her aramayı seçer, her zaman birini arar hatta bazen wo, diyelim, diyelim, diyelim, diyelim ve son kez, yoksa biri onu ciddi şekilde taciz etti, pandemi tacize birdenbire farklı günlerde birden fazla çağrı rastgele numara tacizi yanıtladı"
122,debt_collection,federal öğrenci kredisi geri ödeme süreci federal vergi iadesi mektubu tamamlama federal öğrenci kredisi geri ödeme süreci federal vergi iadesi stopaj mektubu eğitim departmanını gösteren eyalet iade etmelidir geri ödeme belgesi Maliye Bakanlığı alınan iddianame mevcudiyet telefon iletişim türü doğrudan ihtiyaç geçen yıl çağrı numarası kredi kredi yatırım süresi çağrı kurtarma fonu borç geri ödeme yılı dosya geri ödeme talebi dolandırıcılık yılı tahsilat geri ödeme geri ödeme geri ödeme geri ödeme geri ödeme yılı kredi geri ödeme kredisi
123,debt_collection,lehtar için alacaklı profilini kullanan geçmiş işlem tamamen geri kazanılan ürün iadesi citibank üçüncü şahıs hırsızın eve girmesine izin verir mali tablonun bir kopyası çevrimiçi bankacılık kartının gözden geçirilmesine izin verir mali bilgilerin yönetimi ayrı ayrı
124,credit_card,İleri Tarih Sal Konu Lütfen Araştırın Comenity Bank Bayi Kart Dolandırıcılığı Gönderildi Merhaba Adı Dolandırıcılık Comenity Bank Kredi Kartı Sağlayıcısı Çocuk Yeri New York Forever Victoria Secret Orijinal Kredi Comenity Bank Bir Kat Almaya Başladı Geç ücretlerle birlikte aşırı ihraç ücretleri yakından izlendi. ayrıca kart tespit limiti değişti iyi aşırı geç ödeme şirket şirket değiştireceğini söyledi banka kredisi kredi limiti orijinal limite ulaşıldı dedi maksimum ödeme hesabı etkilendi sabit kredi kartı kredi kartı kredi notu kredi notu keskin bir şekilde düştü olumsuz durum şu anda vadesi gelen tutarı ödüyorum bozuk borç şirket ücreti kredili mevduat ücretleri geç ücretler kendi kendine başlangıç ​​kredi limiti büyük ölçüde değişir şirket büyük komisyon alır hesabı düzeltmek istiyorum kızgın avukat nedenleri açıkladı a ile iletişime geçiyorum ben krediyi yok eden bir çalışan şirketim plz yardım isim iletişim bi ilginiz için teşekkürler
125,credit_card,"American Express geçerli bir gerekçe göstermeden kredi limitini düşürdü, uyardı, temsilci, kredi limitindeki düşüşün sebebinin kredi raporunun verilmesine istinaden bakiyedeki artıştan kaynaklandığını belirtti. American Express hesabının itibarının iyi olmaması, kredi kartı üyesine erişmek için American Express hesabıyla gerektiği gibi ilgilenmeye karar verdi, bir cfpb mali düzenleyicisinin ödeme gücü, finansal kurumu müşterilerin ihtiyaçlarını karşılamaya yardımcı olmaya teşvik etti American Express iş uygulamaları, Bir üyeye yardım etmek yerine çalışma kartını yansıtmak için American Express yaratmaya karar verdi. Bunun finansal belirsizliğe yol açabileceğini bilen birçok üye, hastalık nedeniyle işyerinin kapanması nedeniyle gelir kaybıyla karşı karşıya kalabilir. o zaman denetçi temsilcisi iyi bir neden verebilir bilgi eksikliği müşteri hizmetleri becerilerinin eksikliğinin yanı sıra zor zamanlardan geçen müşterilerle sıkı çalışan birçok büyük finans kuruluşunun acilen uygun eğitime ihtiyaçları olduğu gerçeğini öngörmemiş olması da yardımcı olabilir."
126,credit_card,"PNC Talebi Bilgilendirilmiş Kayıt Promosyonu Promosyon Devam Ediyor Uygun PNC Promosyon Talebi PNC Promosyon Talebi Bağlantı Kullanılarak Gönderilmelidir İlişkili Teklif Web Sitesi Belirtilen Önceki Yanıt Başvuru Gönderilen Promosyon İlk Kez Talep Ediliyor Bilgilendirilmiş Kayıt Promosyonu PNC Promosyon Promosyonu Rapor Edilen Kayıt Önceki Cevap Kayıt Dosyalama Süresi Talebi PNC Kayıt Bonusu Teklif Gönderildi Evet İkinci Konuşmak İstiyorum Hak Talebi Çete Yönetimi İlişki Ekibi Gerçekten Talep Tut Talep Süresi uygulaması, pnc kaydı, yeni bilgilerin aptalca gönderilmesi nedeniyle iyi sunulmuş bonus teklifi, devam eden promosyon, temelde geçen ayki promosyonu talep eden diğerleri hakkında yalan söyledi, Teşekkürler. Pnc hesabı açıldığından beri karıştır e-posta al bence her küçük e-postayı iyi kaydetmenin gerekli her küçük e-postayı al gelen kutusunu al hafızayı yenilemek için ezici promosyon al udaap'a göre meslektaş talep talebinde teklif bulunamadı CA Gerekli Kredi hesabını buna göre deneyin Doddfrank Wall Street reformu Daha önce iş arkadaşları bilgilendirilmiş Telefon gerekli Bonus e-postasını göster Söz verilen kanıt gönderildi E-posta iste Üzgünüz hiçbir şey e-posta uyarısı Ekran görüntüsü E-posta pnc vaat edebilir Pnc verin ama kanıt gösterin Başvuru sahibi müşteri talebinde bulunduğunda promosyon teklifine ihtiyaç var gerçek teklif ayın sonunda kabul edildi zaten kanıtlanmış zaman yalan yetenekli gerekli kanıt gösterme talebi sahte kredi takibi ile teklif bonusu kredi takibi ile teklif bir makara aldı e hizmet en kötü yalanlar iddia edilen teklif udaap doddfrank duvarı tüketici koruma yasası sokak reformu"
127,credit_card,"yeni bir şikayet, dosyalama, zaman, işlem, soru, kart sahipliği, saygıyla reddet, talep, kalıcı, ilk, saygıyla, her şey, ikinci, kart sahipliğini onayla, neden, yanıt süresi, yayınlanma süresi, son derece belirsiz yanıt temelinde başka yürütülen soruşturma, şu ana kadar verilen delil, iddia, soruşturma yapıldı, soruşturma, belge kart sahibinin borçlu olduğuna dair kanıt içeriyor, yasal, belgenin nüshası saygısızca reddetme, ret, kalıcı kredi talep etme, ayrıca kredi bürolarına hesap bildirme, temerrüt bildirme, ayrıca devlet borç raporu, rapor et, rapor al, ayrıca hemen sonraki çözümü rapor et, rapor edilen iflas hiçbir şey kirli tembel insanlar"
128,credit_card,şikayet iki ay önce gönderildi american express adresini ver müşteri hizmetleri bilgileri reddetti birçok istek gönderildi telefon numarası cfpb yeterince mesajı unut american express sorunu çöz
129,credit_reporting,va geçmiş şikayet experian kredi bürosu karar vermeyi içerir intikamı durdur ayrımcılığın yanlış davranışı amerikalı vergi mükellefinin haksız davranışı bugün erişim reddedildi experian ücretsiz yıllık kredi raporuna erişim reddedildi özellikle kısıtlayıcı ayrımcılık maddesi ekleyerek birçok kanıt ters eylemlere tabi gerçek intikamı destekler experian kredi bürosu izin verir katılmak hasar finansal itibar experian ciddi duygusal nedenlere neden olur sıkıntı experian engellenmiş yetenek gözden geçirme kredi raporu bu nedenle olumsuz herhangi bir rapor zarara neden olur tam yasal sorumluluk experian özür dilemek kısıtlamayı haklı çıkarmak web sitesi experian yer vermeli experian experian dahil karar verici intikamı durdurmalı temel yasal sonuç ücretli yasa dışı eylem amerikan vergi mükellefi cfpb experian yasa dışı uygulamayı araştıracak denetimli serbestlik niyeti zararları finansal itibar gerçeği kanıtlanmış gerçek hasar zaten neden oldu experian kiş lütfen experian yanıtını dikkate alın yasal şikayet kullanır experian dahil süre karar verme mahkeme kanunu burada belirtilen mevcut durum mahkumiyet bilgi anlayış düzeltme konu değişiklik türü zaman feragat olmadan yasal temsilci dava dijital olarak imzalı
130,credit_reporting,Tahsilat hesabı hesabı açık hesap hesabı açık hesap bakiyesi
131,credit_reporting,"birden fazla hesap reddi aldı. Nexislexis lexisnexis raporu hakkında rapor sipariş edildi, çünkü kopya hiç alınmadı, kopya ifşası geçen ay talep edildi, araştırmadan sonra gönderilen kağıt talep formu lexis nexis raporları yayınlandı indirme bağlantısı ama asla lexis nexis hiçbir şey almıyor çoğu zaman lexis nexis bir dosya aramayı reddediyor müşteri hizmetleri temsilcisi sürekli yapar bir istek istek döngüsü takibi asla bizimle bir banka hesabı almak için belge göndermez lexisnexis sistemi"
132,credit_reporting,"isim son dört s yaz xxxxmy hesap numarası anlaşmazlık geç ödeme bildirildi kohl etkilendi hastane uzun süre iş kaybı kohl tavsiye edilen ödeme gecikti alındı ​​kredi uyarısı gecikmiş ihlal bildirildi bakım kanunu geç ödeme ödendi kaldırıldı hesabı doğru tamamen kredi raporu hatalı geç ücreti kaldır dedi koruma sağlandı bakım eylemi başarısız oldu sorumlu önerilen kohl, ertelenmiş plan adı verilen yazılı bir bildirim aldı izin temsilcisi, akıl sağlığı korumalı kohl'un uygun şekilde uyması gerektiğini söyledi bakım eylemi onarım kredi raporu geç ödeme çağrısı yapıldı hesap olumsuz söylenti hesabın kredi limitini belirleyeceğini tahmin et yasa dışı kredi harap udapp ihlali bakım ihlali eylemi"
133,credit_reporting,Ekte bakınız Kredi kartı ödemesini düzenleyen müşteri adına girilen mutabakat sözleşmesinin eki tebligatın tamamı alınan tebligatın tamamı ödenen hesabın ekli yazısına bakınız Banka hesabından çekilen tutarın banka dekontu ile mutabakatı ekli dekont ekli banka dekontu ekli hesaba gönderildi ek ücret ödendi ek ücret ödendi gönderilen ek mektubun miktarına bakın gönderilen borç ödendi irs bakın Ekli form hala ödenmemiş kredi bürosu hesabının hala vadesinin geldiğini gösteriyor. Teklif edilen miktar tahliye edildi. Kavga. Equifax reddedildi. Ekteki anlaşmazlığa bakın.
134,credit_reporting,"kredi çekilen borç veren ev satın alma kredi talebini borç veren bildirdikten sonra hazırlıyor saldırgan beyanı kredi citi banka ödeme kartı işlemi uçak bileti konaklama süpervizörü aradı citi banka aradı çağrı süresi citi banka talebi saldırgan beyanı onaylanmış adres sağlandı bilgilendirilmiş belge gönderiliyor sorunu çözmeye çalışıyor belgeler gönderilmeden önce hiç çağrılmadı Citi Bank arama süresi, citi bankada arama, alacaklı tarafından talep çözülebilir, benzer bir iflas başvurusu hakkında bilgilendirilir, yalnızca belirli bir borç sonucu, küçük düşürücü beyan, adı geçen bir kredi citi bankasının sorumluluğu reddedildi anlaşmazlıkta sorumluluk reddedildi yöneticiyi çözmeyi reddetti konuşmak istedi müdür cevapsız geri aradığını söyledi cevapsız geri arama Citi Bank dolandırıcılık departmanı aradı Citi Bank bankayı aradı Moshe önleme departmanı geri aradı Bilgilendirilmiş müdür tahsilat departmanını geri arar Soru sorulduğunda verilen bilgileri toplar departman oluşumu anır şehir bankasını aradı çağrı süresi borç tahsilat departmanı borç tahsilat departmanı temsilcisini aradı s.p. Beyan edilen numara, ayrıca uygun, mevcut ev, apartman numarası, faturalandırma, doğru protokol, daha önce sorulan soru aracılığıyla Citi Bank ile iletişime geçin, doğrudan sorumluluğa itiraz etmek için doğrudan bildirilen üç kredi bürosuyla birkaç kez iletişime geçmek gerekir. Açık soruşturma istendi Süpervizör, gelen arama sırasında geri arayacağını bildirdi Çağrının süresi konuşuldu Çalışan kimliği, yardımın zaten sağlandığını belirtti BT personeli mali sorumluluk hiçbir zaman başlamamasına rağmen gerekli özeni gösterdi"
135,credit_reporting,merhaba isim birçok kez iletişime geçmeye çalıştım sorun düzeltildi cevap alındı ​​uzak hata adresleri istihdam bilgileri cari yıl kredi hesabı ekstra rahatsız edici bilgiler görüntülenen kredi raporu bilgileri iş adresi iş adresi bilgileri silinmeli öncelikli öncelikli raporlama bilgileri ar ar
136,credit_reporting,şoklu denetlenmiş kredi raporunda belirlenen geç ödeme tarihi wfds
137,credit_reporting,eski hesabı yenilemeye devam et eski hesap bölüm hesabını ihlal ediyor fdcpa fcba cra vilates
138,credit_reporting,"Yanlış isim, adres, işletme bilgileri, ilişki bilgileri, yakın şirket, gerçekten yetenekli, kötü etki, kredi raporu, yanlış bilgi talebi, isim, adres, işletme bilgileri değişikliği gördüğüm için kredi raporunu düzenlemeye çalışıyorum. hemen silindi."
139,credit_reporting,ekli ilk özel yazılı başvuru qwr öğesi gerekli portföy seçin hizmet sps sabit ipotek ödeme tahsilatını kanıtlar kanıt yok spss kalıcı sps kredi raporu yanlış mazeret gizliliğin ihlali fcra sps güvenli hesap yoluyla para toplama güvenli özel
140,credit_reporting,gerçek kimlik hırsızlığı kurbanı kimlik hırsızlığı listelenmiş iki bilgiyi almaya çalıştığından beri dolandırıcılık nedeniyle isabet kaldırıldı kredi raporu görünüyor işlem yapıldı sonuç kimlik hırsızlığı da kurban veri ihlali birden fazla hesap kredi raporu mayın listelenmiş ayrıca kredi raporu dosyalandı ftc polis raporu destek talebi burada ftc rapor polis rapor numarası ive experian geçen yıl aradım dördüncü hatta arandı hesap bulunamıyor tarihi kullanarak doğrula doğum onayı experian rapor numarası hesap adı hesap numarası tarih açılan hesap adı hesap numarası hileli borç kredi başvurusunu engelliyor hatta ilk kez kredi kartı alıyor insanlar kredi oluşturmaya çalışmak bil bir sonraki adıma başla çözüme git durum finansal duygusal strese neden oldu en kötü kısmı işe dayalı bilgi verilmedi reddetme raporu konusu CRA raporlarıyla ilgili olumsuz eylem yanlış bilgi sonucu dolandırıcılık kurbanı hırsızlık yeri dolandırıcılık uyarısı kredi raporu Ayrıca dosya ilçe şerifinin ofisine bir kopya polis raporu yükledim FTC raporu çok yardım için teşekkürler
141,credit_reporting,gerçek kimlik hırsızlığı kurbanı kimlik hırsızlığı bilgileri listede görünüyor hesap numarası hesap adı hesap numarası hesap adı hesap numarası hesap adı hesap numarası hesap adı hesap numarası hesap adı hesap numarası hesap adı hesap numarası
142,mortgages_and_loans,kapalı ipotek dovenmuhle ipotek hesabında ödenen önemli bakiye iade için bekliyordu Çek hiç gelmedi dovenmuhle aradı çekin gönderileceğini söyledi normal işlem hafta iş günü nakliye çağrı bekliyor iade çeki asla gönderilemiyor yeni adres gönderilebilir telefon e-posta e-posta imzalı belge güncelleme istiyor posta adresi bir gün beklemesi istendi geri arama doğrulandı geceyi geçirmek istedi kabul edildi başlangıçta arandı dedi e-posta bir daha asla alınmadı iki farklı e-posta adresi nihayet bulundu dedi ilk denemek istedi geceyi geçirdi sözcü menajerin onaya ihtiyacı olduğunu söyledi menajeri aradı aradı geri aradı çek geri aradığı hafta içinde işlenecek bir mesaj bıraktı yöneticiden geri aradığı gece için bir dakika geç kalmasını istedi hepsi sor yönetici bir dakika gecikme otomatik arama devre dışı waaaayyyy ertesi gün pencere geri garanti tam işlemi yasadışı olarak para tutmak için kabul edilemez
