,product,narrative
70,credit_reporting,isim son dört s yaz xxxxmy hesap numarası anlaşmazlık geç ödeme bildirildi kohl etkilenen hastane uzun vadeli iş kaybı kohl tavsiye edilen gecikmeli ödeme alındı ​​kredi uyarısı gecikmiş ihlal bildirildi bakım kanunu geç ödeme ödenmiş silinmiş hesap düzeltildi tamamen hatalı kredi kaydı silme gecikme ücreti dedi koruma sağlanamadı bakım eylemi sorumlu önerilen kohl ertelenmiş plan adı verilen yazılı bir bildirim aldı izin temsilcisi dedi ki akıl sağlığı korumalı kohl uygun bakım işlemine uymak zorundadır kredi raporu onarım gecikme ödeme itiraz gerçek hesap olumsuz söylenti tahmin hesap kredi limiti belirleyecek yasadışı kredi harap udapp ihlali bakım ihlali eylemi
71,credit_reporting,kredi kartını veren müşteri adına girilen uzlaştırma sözleşmesi ekli yazıya bakınız ödeme tam tebligat alındı ​​tamamen ödenmiş hesap ekli mektuba bakınız ekli banka dekontu aracılığıyla banka hesabından çekilen tutarın mutabakatı ekli banka dekontu ekli hesap gönderildi ödenmiş ek ücret ödenmesi gereken ek mektup tutarını görün gönderilen borç ödendi irs bkz. Ekli form hala ödenmemiş kredi bürosu hesabının hala borçlu olduğunu bildiriyor. Sunulan miktar taburcu edildi. Kavga. Equifax reddedildi. Ekteki anlaşmazlığa bakın.
72,credit_reporting,"kredi veren borç veren ev satın alma kredi talebini hazırlıyor borç veren beyanından sonra saldırgan kredi kartı ödemesi kredi kartı ekstresi citi banka konaklama havayolu bileti işlem sorumlusu adlı citi bankası çağrı süresi citi banka talebi karalayıcı adres talebi saldırgan adres sorunu daha önce citi bankası adı verilen belgeler gönderilmedi çağrı süresi, citi bankasını arayarak, alacaklı tarafından tazminat talebinde bulunulabileceğini, benzer bir iflas depozitosu bildirildiğini, sadece belirli bir borç sonucunun, küçük düşürücü beyanın, Citi Bank markalı bir kredi bankasındaki anlaşmazlığı çözmeyi reddettiği yöneticinin konuşmak istediğini, yönetici yapacağını söyledi cevapsız çağrıda arama, banka dolandırıcılık departmanı, citi bank denilen banka dolandırıcılık departmanı, zaman aşımı denilen anti-moshe departmanı Geri O bilgilendirilmiş yönetici tahsilat departmanını geri arayacaktır İstenirse, Anır'ın verilen departman bilgilerini toplayın, arama sırasında tahsilat departmanı temsilcisi s.p. beyan edilen numara, ayrıca uygun, mevcut ikametgah, daire numarası, beyan, doğru protokol, daha önce gönderilen soru ile ilgili olarak Citi Bank ile iletişime geçin, yükümlülüğe doğrudan itiraz ile birkaç kez doğrudan adı geçen üç kredi bürosuyla iletişime geçilmesi gerekir. Açık sorguda amirine gelen arama sırasında geri arayacağının bildirilmesi istendi, görüşme süresi, kimlik memuru konuştu, yardımın zaten verildiğini açıkladı."
73,credit_reporting,merhaba isim birçok kez iletişime geçmeye çalıştım sorun düzeltildi cevap alındı ​​uzak hata adresleri istihdam bilgileri cari yıl kredi hesabı ekstra rahatsız edici bilgiler görüntülenen kredi raporu bilgileri iş adresi iş adresi bilgileri silinmeli öncelikli öncelikli raporlama bilgileri ar ar
74,credit_reporting,şok wfds gözden geçirilmiş kredi raporunda geç ödeme tarihi bulundu
75,credit_reporting,"Eski hesabı güncellemeye devam edin Eski hesap, bölüm hesabını ihlal ediyor fdcpa fcba cra vilates"
76,credit_reporting,"Yanlış isim bilgileri, adres, iş bilgileri, ilişki bilgileri, yakın iş, gerçekten yetenekli, kötü etki, kredi raporu, yanlış bilgi beyanı, isim, adres, iş bilgileri değişikliği, kaldırılması gerektiğini gördüğüm için kredi raporumu değiştirmeye çalışıyorum. hemen."
77,credit_reporting,ekli ilk özel yazılı başvuru qwr öğesi gerekli portföy hizmetini kanıtla sps istikrarlı ipotek ödemesi makbuz olmadan tahsil et spss sabit sps kredi raporu yanlış özür mahremiyet ihlali fcra sps güvenli hesap aracılığıyla bağış toplama güvenli özel ipotek sps müşteri incelemeleri ana iş hedefi hileli haciz eve el koyma
78,credit_reporting,Gerçek kimlik hırsızlığı kurbanı olarak kimlik hırsızlığı iki bilgi almaya çalıştı dolandırıcılık isabet silindi kredi raporu görünüyor işlem yapıldı sonuç kimlik hırsızlığı da kurban veri ihlali birden fazla hesap kredi raporu mayın listelenmiş çok kredi rapor gönderildi ftc polis raporu destek talebi burada ftc rapor polis raporu numarası ive geçen yıl experian aradı 4. satır arandı hesap bulunamadı tarihi kullanarak doğrula doğum onayı experian rapor numarası hesap adı hesap numarası tarih açılan hesap adı hesap numarası sahte borç kredi başvurusunda bulunmayı hatta ilk defa kredi kartı almayı deneyenleri engelliyor kredi oluştur bil sonraki adım başla çözüme git durum finansal duygusal strese neden oldu en kötü kısmı işe dayalı bilgi sağlanmadı inkar raporu tion sorunu MKK raporlarında olumsuz eylem dezenformasyon sonucu dolandırıcılık mağduru hırsızlık yeri dolandırıcılık uyarısı kredi raporu ayrıca ilçe şerif ofisine şikayette bulunun polis raporunu yükledim opya FTC raporu yardımlarınız için çok teşekkür ederim
79,credit_reporting,Gerçek Kimlik Hırsızlığı Mağdurun Kimlik Hırsızlığı Bilgileri Listelenmiştir Kredi İşlemi Sonucu Kimlik Blok Bilgileri Raporu Üyelik Equifax Veri İhlal Başvurusu Sonuç Olarak Gönderilmiştir Açık Kredi Girişimi Dolandırıcılık Madde Numarası Rapor Numarası Dosya Numarası Equifax Dosya Numarası Hesap Adı Hesap Numarası Hesap Adı Hesap Numarası Hesap Adı Hesap Numarası Hesap Adı Hesap Numarası Hesap Adı Hesap Numarası Hesap Adı Hesap Numarası Hesap Adı Numarası hesap adı hesap numarası hesap adı hesap numarası
80,mortgages_and_loans,kapalı ipotek dovenmuhle ipotek hesabında tam önemli bakiye ödendi geri ödeme bekleniyor çek hiç gelmedi denilen dovenmuhle dedi ki çek gönderildi beklemede işleniyor normal hafta iş günü sevkıyat geri çağrıldı çek asla gönderilmedi yeni adresi güncelleyebilir telefon e-posta gönder imzalı belge istedi güncelleme posta adresi bir gün aranması istendi geri alındı ​​kontrol edildi gece kalmak istedi kabul edildi arandı başlangıçta söylendi e-posta asla geri dönmedi iki farklı e-posta adresi sonunda bulundu dedi ilk önce denemesi istendi gece kaldı temsilci yöneticinin onaya ihtiyacı olduğunu söyledi yönetici aradı yönetici geri aradı kontrol etmek bunun olacağını söyleyen bir mesaj bıraktı hafta içinde işlenen geri aradı geri aradı yöneticiden gece için bir dakika ertelemesini istedi geri aradı her şey yöneticiden bir dakika geç istedi otoma tische anketi devre dışı waaaayyyy son zamanlarda pencere iade emanet tüm süreç parayı tutmak için yasadışı olarak kabul edilemez
81,mortgages_and_loans,ilk başta başarı fargo ipotek refinansmanına devam et başvuru şimdi ön ödemeli uygulanmış araştırma kağıtları kredi tamamlandı nihai karar onaylandı gelecek hafta kredi borç nedeniyle reddedildi en iyi kredi ipotekle cari yılı azaltacak p l daha yüksek geliri yansıtıyor mevcut nisan yardımla azalacak
82,mortgages_and_loans,orijinal ipotek alındı ​​satıldı kredi hizmet şirket boşanmış hizmet üyesi yıllar evlilik ev üzerinden boşanma aldı boşanma nafaka aldı tam ilk yıl bekar anne müdahale talep etti işveren desteksiz kombine ani kayıp nafaka ödemesi geride kaldı ipotek ödeme zorluğu başladı kredi değiştirme şirket hala ipotek ödemede zorluk düştü mücadele temel onarımı karşılayabilir birleşik aylık masraf mülk dosyalanmış tapu ikame haciz evi duygusal olarak sevildi şimdi doğru şeyi isteyebilir haciz kaybedilen iş tamamlandı kağıt haciz birisi yaklaştı faiz ev adı komisyoncu kısa satışla ilgilenebilir kredi hizmeti şirket noktası kapalı derin komisyoncu komisyoncu dedi her şeyi durdurabilir kısa satış her şeyin icabına bakardı komisyoncu tek iletişimci oldu ilgilenen emlak kredisi hizmeti net şirket unvanı kontrol evi net ay git ilgilenen kişi ilgili başka bir taraf bıraktı komisyoncu devam etti sorun başlık çalışma soruyu tartışmak noktada kırıldı yaz hastaneye kaldırıldı ayrıca hizmet verildi haciz kağıt hastaneye yatış başladı soru komisyoncusu banka eve daha uzun isim söylemek transfer sekreter va komisyoncu satmaya devam etmeye çalış ev iddia orijinal dosyalanmış ilçe katip tapu transfer sekreter üniversiteye geri gitti yaz bir profesör avukat komisyoncu bankayla son ödeme yapıldı hesabın tamamı kaydedildi temasa geçildi va dedi tapu geri devredildi kredi hizmeti şirket birisiyle iletişime geçebilir kredi hizmeti şirketi bilmek istedi kağıt konşimento kesin olarak bilmek istedi arandı tamamlandı kredi başka bir avukata yönlendirildi haciz teklif edildi avukat tedavi işbirliği arzusu geçen yıl her ay tamamlandı kredi hizmet şirketi geç ödeme bildirdi kredi mahvoldu avukat bulamıyor istekli temsil dava onarım kredi mükemmel ödeme kredi kartı araba kredisi ödenen araba erken kapandı iki küçük borç puanı kullan kiralama acentesi e uygunluk korkusu nth kısıtlama canlı her yerde iyi kredi memuru hala geç ücretleri rapor ediyor vadesi geçmiş ödeme uzun yıllar tahakkuk ediyor hala haftada birkaç kez temasa geç fikir kredisi yok edilmiş yıl daha kötü izin eve gitmek haciz hatta kredi almak
83,mortgages_and_loans,"phh ipotek adında bir emlak vergisi mektubu suçlu alanı var para çek teminat hesabı dedi karışıklık aradı dedi geri aradı cuma aradı eskalasyon müdürü öncelik vereceğini söyledi öncelik vereceğini söyledi gerekli gerekli dosyanın bir kopyasını aldım faks varsayılanı e-posta ile vergi beyannamesi aranabilir, ilçe faks tarafından aranabilir, bırakılan başvurunun bir kopyasını e-posta ile gönderebilir, vergi beyannamesi adı verilen bir e-posta alabilir, geri gönderilebilir, e-posta adresi aranabilir, vergi beyannamesi gönderilecek. güncellemeye cevap"
84,mortgages_and_loans,yangın evi kurtarıldı deneyimli hasar sigorta şirketi sevk edildi hızlı iyi iş kontrol penceresi erimiş hasarlı parça banka ipotek sahibi kontrol izi onaylandı kontrol yapıldı baskı işi tamamlandı satıcı iş ödendi sigorta şirketi sevk edildi kontrol ferforje çit iş le yıkıcı satıcı her zaman numune gecikme kontrol yapıldı test edildi takip edildi ofis mevduat fonunu takip etmek istedi dahili hesap her zaman birisinin geri ödeme yapması gerektiğinde işlem yapmak gerekli yükü aileye özellikle zaman borcunu eve takip etmek ödeme zamanı para tasarrufu mevduat hesabına ek yük koymak zaman stresli sebep verilen sahiplik yüzdesi iyi ödeme geçmişi
85,mortgages_and_loans,"nihai fatura, usps aracılığıyla alınan tarihi içeren nihai fatura, hasar tipini detaylandıran destekleyici belgelerin türünü içerir, gerekli onarım onarım beyanını içeren fotoğraflı mekanik belgeler, ücret belgesini doğrular arıza arama takım sonu sonuç garantisi talep edilen bilgileri çevrimiçi olarak alabilirsiniz tüketici finans şirketi sağlanan sorumluluk bilgisi faturayı doğrular"
86,mortgages_and_loans,"Özet Citibank ödemeyi imkansız kılıyor Gereksiz bakiyeyi kontrol et teslimat adresini veya hatta geçerli bir telefon numarasını reddet, bunun yerine geç bir ücret ekle çünkü inanılmaz bir şey görünüyor cari hesabı kontrol et artı bekleyen miktarı dene alınan teslimat adresi Citibank'ın kabaca bakiyesi Citibank bakiyesi kapalı, çevrimiçi bankacılığa erişim daha uzun süre kontrol edilebilir tam tutarı onayla hesap bakiyesini görüntülemeye devam et bakiyeyi görüntüle hesap bakiyesini görüntüle hesabı kapatmaya karar verildi aktif Citibank çevrimiçi sohbet işlevi tekrarlanan telefon görüşmesi nedeniyle başarısız oldu cari çek bakiye aktarılan kredi acenteye uygulandı bakiye ödeme limiti zaten ödenmiş Bakiye bakiyesi alakasız Notes değeri ödemesi tutar cari hesap havalesi hesap bakiyesi kapalı sokak ödemesi artık mevcut değil r cevaplar özel kredi departmanını takip edin hemen yapıldı doğrudan numara lütfen iletişime geçin satış ekibi ödemenin yönlendirilebileceğinin tamamen farkında cevaplandı çek fon banka hesabı da çek gönderin lütfen özel çevrildi numarayı belirtin numarayı belirtin menü öğesi ile ilgili görev geçti alternatif yol tekrar denendi sonunda biriyle konuşmayı başardı ama adını anlayamıyor çağrı tahsilat hesabı iptal edildi Tekrar yönlendirilen numara ayrıca gecikme ücreti eklendiğinden emin olun kredi eklendi, aradı, numarayı kaydetti, listelenen numara birkaç kez prizi engellemeye çalıştı, Citibank önemsiz borçları ödemeyi ve ne olursa olsun gecikme ücreti eklemeyi kelimenin tam anlamıyla imkansız hale getiriyor. DC, kırk yıl garanti, deyin, hiçbir şey, elbette, faturayı çevrimiçi ödemeye çalıştı, Citibank web sitesi, cevaplar, mesaj, hesap detayları, aktivite bilgileri mevcut, kapalı"
87,debt_collection,"Kiralama şirketi ""Illinois"" imzalı kira sonu kötü taşınma borçları, gönderilen hasar kanıtı, belgeler, tahsilatlar, yanıt alındı, bir ay sonra bildirim alındı, fatura, tahsilat, telefon alınmadı, ""tahsilat"" adlı posta tahsilat acentesi, beklemede Taşınma tarihi, emlak şirketinin beyanı vardır."
88,debt_collection,Alacaklılar gelir ve giderleri bildirmeyi reddediyor
89,debt_collection,portföy kurtarma ortak birden fazla günlük arama yapma ikamet günlük konuşma talep edilen aramayı yok sayma isteği lütfen yardım edin zaman farklı numara arayın arayan kimliği portföyrecov teşekkür ederim
90,debt_collection,"her gün, bazen günde birkaç kez arar, bir yılın borcunu toplar, belki başkaları önemli telefon görüşmelerini bekler, her aramayı seçer, her zaman birini arar hatta bazen wo, diyelim, diyelim, diyelim, diyelim ve son kez, yoksa biri onu ciddi şekilde taciz etti, pandemi tacize birdenbire farklı günlerde birden fazla çağrı rastgele numara tacizi yanıtladı"
91,debt_collection,federal öğrenci kredisi federal vergi iadesi süreci iade stopaj mektubu tamamlandı federal öğrenci kredisi federal vergi iadesi süreci iade stopaj mektubunu göster eğitim departmanı eyalet iade etmeli geri ödeme belgesi hazine bakanlığı aldı iddianame devam telefon tipi doğrudan iletişim önceki yıla ihtiyaç var geri ödeme çağrı numarası ödünç alınan kredi yatırım zamanı arama kurtarma fonları sorumluluk geri dönüş yılı dosya geri ödeme talebi dolandırıcılık yılı geri ödeme geri ödeme geri ödeme geri ödeme geri ödeme yılı kredi kredi almak
92,debt_collection,bilgi uçuran alacaklı profilini kullanan geçmiş işlem tamamen iade edilen ürün iadesi citibank üçüncü taraf hırsızın eve girmesine izin verir mali beyanı kopyala kart girişine izin verir çevrimiçi bankacılık incelemesi mali bilgileri ayrı olarak yönetin
93,credit_card,"Gönderim tarihi Sal Konu, lütfen Comenity kart perakendecisi dolandırıcılığını, merhaba, isme göre dolandırıcılığı araştırın. Childrens Place'de Comenity Bank Kredi Kartı Sağlayıcısı New York Forever Victoria Secret Orijinal Kredisi Comenity Bank Alt Limite Başladı Gecikme ücretleriyle birlikte, fazla harcama ücretleri de yakından izlenmeye başlandı ve kart açma limiti oldukça değişti Aşırı vadesi geçmiş ödeme Şirket değişeceğini söyledi banka kredisi kredi limiti, ilk limite ulaştı yukarıda bahsedilen tepe ödeme hesabı etkilendi kredi kartı kredi kartı kredi notu sert şekilde düştü kredi notu sert düştü olumsuz durum şu anda vadesi gelen tutarı ödüyorum. yolsuzluğa olumsuz etkilenen borç şirket ücreti kredili mevduat ücretleri çok geç ücretler ilk kredi limiti bile çok dalgalanıyor şirket büyük bir komisyon alıyor hesabımı düzeltmek istiyorum kızgın avukat nedenleri söyledi a benimle iletişime geçiyorum krediyi yok eden bir çalışan şirketim lütfen yardım isim iletişim bi İlginiz için teşekkür ederiz"
94,credit_card,"American Express geçerli bir gerekçe göstermeden kredi limitini düşürdü, önceden haber verdi, temsilci kredi limitinin düşürülmesinin nedeninin bakiyedeki artıştan kaynaklandığını belirtti gerçeğe dayanarak, kredi raporu sağlandı. American Express hesabında iyi itibar başarısız oldu kredi kartı üyesine erişmek için American Express hesabına düzgün bir şekilde bakmaya karar verdi, birinin kredibilitesi cfpb mali düzenleyicisi, finansal kurumu müşterinin acil ihtiyaçlarını karşılamaya yardımcı olmaya teşvik etti American Express iş uygulamaları, bir çalışma kartı üyesine yardım etmek yerine çabaları yansıtmak için American Express oluşturmaya karar verdi. Bunun finansal belirsizliğe yol açabileceğini bilerek, birçok üye hastalık nedeniyle işyerinin kapanması nedeniyle gelir kaybıyla karşı karşıya kalabilir. o zaman denetçinin temsilcisi iyi bir neden sunabilir, bilgi eksikliği müşteri hizmetleri becerilerinin eksikliği yardımcı olabilir, ayrıca zor zamanlardan geçen müşterilerle sıkı çalışan birçok büyük finans kurumunun acilen uygun eğitime ihtiyaç duyduğu gerçeğini sağlayamadı"
95,credit_card,Pnc talebi hakkında bilgilendirilmiş kayıt promosyonu devam eden promosyon siparişi hak kazanan pnc promosyon başvurusu bağlantı kullanılarak gönderilmelidir. evet ikinci konuşmak istiyorum hak talebinde bulunun hak talebinde bulunun çete yöneticisi ilişki ekibi gerçekten hak talebinde bulunun hak talebinde bulunun süreyi koruyun uygulama pnc rekoru bonus teklifi aptalca yeni bilgiler yayınladığı için iyi sunuldu devam eden promosyon temelde geçen ay iddia eden diğerleri hakkında yalan söyledi promosyon devam ediyor devam eden promosyon ekran görüntüleri ekli krediyi göster o zamandan beri karıştır hesap aç hatta pnc e-posta al iyi kaydetmenin gerekli olduğunu düşün her küçük e-postayı al gelen kutusunu al hafızayı yenilemek için ezici promosyon al meslektaşımla ilgili teklif bulundu udaap'a göre uygulama ication ca gerekli krediyi kanıtla hesap buna göre doddfrank wall street reformu meslektaşları daha önce telefona gerekli e-posta bonusu vaat edilen kanıt gönderildi başvuru e-posta özür dilerim hiçbir şey e-posta uyarı ekran görüntüsü e-posta pnc vaat edebilir ancak kanıt göster başvuru sahibi müşteri talebinde bulunduğunda promosyon teklifine ihtiyaç var gerçek teklif ay sonunda kabul edildi zaman zaten gösterilmiş yetenekli yalan kanıt göstermeli başvuru kredi takibi yoluyla yanlış teklif kredi takibi yoluyla bonus teklifi bir hizmet makarası aldı daha kötü yalanlar reklama uygun sözde teklif udaap doddfrank wall street reformu tüketici koruma kanunu
96,credit_card,"yeni şikayet, gönderim, zaman, işlem, soru, kart sahipliği, saygılı ret, talep, kalıcı, ilk, saygılı, her şey, ikinci, kart sahipliği onayı, sebep, yanıt süresi, postalama süresi, diğer son derece belirsiz yanıt sorgusuna dayalı, kanıt şimdiye kadar verilen, talep, soruşturma yapıldı, soruşturma, belge kart hamilinin borçlu olduğu kanıtları içeriyor, yasal, kayıtsız şartsız reddettiği, reddettiği, kalıcı kredi talep ettiği belgenin kopyası, ayrıca kredi raporu, temerrüt raporu, ayrıca devlet borç raporu, rapor, rapor al , ayrıca hemen bir sonraki çözümü rapor edin, iflasın hiçbir şey kirli tembel olmadığını bildirdi"
97,credit_card,şikayet iki ay önce gönderildi american express adresi ver müşteri hizmetleri reddedildi bilgi birçok istek gönderildi telefon numarası cfpb yeterli mesajı unutmak american express sorunu çözmek
98,credit_reporting,"va hikaye şikayet experian kredi bürosu dahil karar verici misillemeyi durdur ayrımcılığı suistimal amerikan vergi mükellefinin erişimi bugün reddedildi experian ücretsiz yıllık kredi raporuna erişimi reddedildi özellikle kısıtlayıcı ayrımcı madde ekleyerek kapsamlı kanıtlar gerçek misilleme konusunu destekler olumsuz eylem experian kredi bürosu katılıma izin verir finansal itibar hasarına neden olan experian ciddi duygusal sıkıntıya neden olmak experian engellenmiş yetenek incelemesi kredi raporu bu nedenle olumsuz herhangi bir rapor hasara neden oldu tam yasal sorumluluk experian özür kısıtlamayı haklı çıkarmak web sitesi experian kurmalı experian experian dahil karar verici misillemeyi durdurmalı büyük yasal sonuç ödenen yasa dışı eylem abd vergi mükellefi cfpb experian yanlış uygulamayı araştıracak bir experian, finansal itibara zarar verme niyetindedir. kanıtladı fiili zarar zaten yapıldı experian kiş i lütfen experian yanıtını dikkate alın yasal şikayet kullanıldı experian dahil karar verici zaman mahkeme kanunu burada belirtilen mevcut durum inanç bilgi anlayış konu düzeltme tür zaman feragat olmadan yasal temsilci dava dijital olarak bugün cfpb'de dosyalandı"
99,credit_reporting,tahsilat hesabı açık hesap bakiyesi
100,credit_reporting,"birden fazla hesap reddi aldı Geçen ay talep edilen ifşa raporunun bir kopyası hiç alınmadığından, soruşturmadan sonra bir kağıt talep formu gönderildiğinden, lexis nexis bir dosya indirme bağlantısı gönderdiğini bildirdi, ancak hiçbir belge almadığı için bir sözlük raporuna bağlantı içeren bir nexislexis raporu sipariş etti dosya müşteri hizmetleri temsilcisi sürekli istek gönderir döngü istek takip asla belge göndermez lexisnexis soğuk şikayeti görmezden gelir tüketici raporu yok doğru bilgi ciddi şekilde ihlal edilmiş şirket bizim için banka hesabı bile açabilir lexisnexis sistemi"
101,credit_reporting,isim son dört s yaz xxxxmy hesap numarası geç ödeme anlaşmazlık bildirildi kohl etkilendi hastane uzun süre iş kaybı kohl tavsiye edilen ödeme gecikmiş kredi bildirimi alındı ​​gecikmeli ihlal bildirildi bakım kanun geç ödeme ödendi silindi tam kredi raporunda doğru hesap hatalı silme geç ödeme belirtilen koruma sağlandı bakım başarısız sorumlu önerilen kohl planı erteleme izni adında yazılı bir bildirim aldı temsilci akıl sağlığı korumalı kohl uygun bakım onarım kredi raporuna uymak zorundadır geç ödeme çağrısı yapıldı hesap olumsuz söylenti o hesap ayarla kredi limiti yasadışı kredi mahvoldu udapp ihlali bakım ihlali eylemi
102,credit_reporting,Ekte gör Kredi kartını düzenleyen müşteri adına girilen mutabakat sözleşmesinin eki yazısına bakınız ödemenin tamamının alındığına dair tebligatın alındığına dair ekteki yazıya bakınız tamamı ödenmiş hesabın ekteki yazısına bakınız ekteki banka dekontu aracılığıyla banka hesabından çekilen tutarın mutabakatı ekli banka dekontu ekteki hesaba gönderildi ek ücret ödendi ödenecek ek mektubun miktarına bakın gönderilen borç ödendi bakın ekteki form hala ödenmemiş kredi bürosu hesabının hala borçlu olduğunu belirtiyor. Teklif edilen miktar tahliye edildi. Kavga etmek. Equifax reddedildi. Ekteki anlaşmazlığa bakın.
103,credit_reporting,"kredi veren borç veren ev satın alma kredi talebini hazırlıyor borç veren beyanından sonra saldırgan kredi kartı ödemesi kredi kartı ekstresi citi banka konaklama havayolu bileti işlem sorumlusu adlı citi bankası çağrı süresi citi banka talebi karalayıcı adres talebi saldırgan adres sorunu daha önce citi bankası adı verilen belgeler gönderilmedi çağrı süresi, citi bankasını arayarak, alacaklı tarafından tazminat talebinde bulunulabileceğini, benzer bir iflas depozitosu bildirildiğini, sadece belirli bir borç sonucunun, küçük düşürücü beyanın, Citi Bank markalı bir kredi bankasındaki anlaşmazlığı çözmeyi reddettiği yöneticinin konuşmak istediğini, yönetici yapacağını söyledi cevapsız çağrıda arama, banka dolandırıcılık departmanı, citi bank denilen banka dolandırıcılık departmanı, zaman aşımı denilen anti-moshe departmanı Geri O bilgilendirilmiş yönetici tahsilat departmanını geri arayacaktır İstenirse, Anır'ın verilen departman bilgilerini toplayın, arama sırasında tahsilat departmanı temsilcisi s.p. beyan edilen numara, ayrıca uygun, mevcut ikametgah, daire numarası, beyan, doğru protokol, daha önce gönderilen soru ile ilgili olarak Citi Bank ile iletişime geçin, yükümlülüğe doğrudan itiraz ile birkaç kez doğrudan adı geçen üç kredi bürosuyla iletişime geçilmesi gerekir. Açık sorguda amirine gelen arama sırasında geri arayacağının bildirilmesi istendi, görüşme süresi, kimlik memuru konuştu, yardımın zaten verildiğini açıkladı."
104,credit_reporting,merhaba isim birden çok kez iletişim kurmaya çalıştı sorun düzeltildi cevap alındı ​​uzak yanlış adresler istihdam bilgileri cari kredi hesap yılı ek rahatsız edici bilgiler görünüyor kredi raporu istihdam bilgileri iş adresinin temizlenmesi gerekiyor bilgi öncelikli hızlandırma bildirildi ar ar
105,credit_reporting,wfds şok revize edilmiş kredi raporunda geç ödeme tarihi bulundu
106,credit_reporting,eski hesabı yenilemeye devam et eski hesap bölüm hesabını ihlal et fdcpa fcba cra vilates
