,product,narrative
34,credit_card,"yeni şikayet, dosyalama, zaman, işlem, soru, kart sahipliği, saygılı ret, talep, ayakta, birinci, saygıyla, her şey, ikinci, kart sahipliğinin teyidi, sebep, yanıt süresi, yayınlanma süresi, diğer son derece belirsiz yanıta dayalı inceleme yapıldı , şu ana kadar verilen delil, iddia, yürütülen soruşturma, soruşturma, belge, kart hamilinin borçlu olduğu delilleri içeriyor, yasal, belgenin fotokopisi, saygısızca ret, ret, kalıcı kredi talep etme, ayrıca bir kredi hesabı bildirme büroları, temerrüt bildirimi, ayrıca devlet borç raporu, rapor, rapor al, ayrıca bir sonraki kararı hemen rapor et, iflas bildir, tembel tembel insanlar hiçbir şey"
35,credit_card,Şikayetim iki ay önce gönderildi amerikan ekspresi müşteri hizmetleri reddedildi bilgi birçok istek gönderildi telefon numarası cfpb yeterince mesajı unuttu american express sorunu çözdü
36,credit_reporting,"va Geçmiş Şikayet Experian kredi bürosu dahil Karar vericiler Misillemeyi durdurun Ayrımcılık Suistimal Bugün Amerikan vergi mükellefleri Erişim reddedildi Experian ücretsiz yıllık kredi raporuna erişim reddedildi Kısıtlayıcı ayrımcılık maddesi ekleyin Özellikle, çok sayıda kanıt gerçek misillemeyi destekler Olumsuz eyleme tabidir Experian kredi bürosu zarara katılıma izin verir Experian'ın finansal itibarına ciddi duygusal nedenler Sebep Experian Engellenmedi Yetenek kontrolü kredi raporu bu nedenle olumsuz Herhangi bir zarar bildirimi tam yasal sorumluluğa neden oldu Experian mazeretleri kısıtlamayı haklı çıkarır web sitesi Experian'ı içermelidir Experian karar vericiler misillemeyi durdurmalıdır Önemli yasal sonuç ödenen yasa dışı eylem Amerikalı vergi mükellefi cfpb Experian haksız fiil uygulamasını araştıracak bir deneyime dayalı mali hasar itibar gerçek kanıtlanmış fiili hasar zaten neden oldu experian kiş dikkate alıyorum lütfen experian yanıt yasal şikayet kullanıldı experian dahil karar mercii zaman mahkeme kanunu burada belirtilen mevcut durum inanç bilmek konuyu anlamak düzeltme türü zaman yasal temsilci iptal davası olmadan dijital olarak imzalanmış cfpb'de dosyalandı bugün"
37,credit_reporting,Borç tahsilat hesabı açık hesap açık hesap bakiyesi
38,credit_reporting,"birden fazla hesap reddi aldı Geçen ay talep edilen ifşa raporunun bir kopyası hiç alınmadığından, soruşturmadan sonra bir kağıt talep formu gönderildiğinden, lexis nexis bir dosya indirme bağlantısı gönderdiğini bildirdi, ancak hiçbir belge almadığı için bir sözlük raporuna bağlantı içeren bir nexislexis raporu sipariş etti dosya müşteri hizmetleri temsilcisi sürekli istek gönderir döngü istek takip asla belge göndermez lexisnexis soğuk şikayeti görmezden gelir tüketici raporu yok doğru bilgi ciddi şekilde ihlal edilmiş şirket bizim için banka hesabı bile açabilir lexisnexis sistemi"
39,credit_reporting,ad son dört yaz xxxxmy hesap numarası anlaşmazlık geç ödeme bildirildi kohl etkilendi hastane uzun vadeli iş kaybı kohl tavsiye edilen ödeme geç alındı ​​kredi bildirimi geç ihlal bildirildi bakım gecikmeli ödeme gecikmeli kesinti kohl bir plan adı verilen yazılı bir bildirim aldı erteleme lisans temsilcisi col mantık tarafından korunduğunu söyledi bakım işlemine uygun şekilde uymalı onarım kredi raporu hesabın geç geri ödenmesi çağrı olumsuz itibar hesabın kredi limitini belirleyeceğini tahmin et yasa dışı koruma enerji ihlali
40,credit_reporting,Ekte gör Kredi kartını düzenleyen müşteri adına girilen mutabakat sözleşmesinin eki yazısına bakınız ödemenin tamamının alındığına dair tebligatın alındığına dair ekteki yazıya bakınız tamamı ödenmiş hesabın ekteki yazısına bakınız ekteki banka dekontu aracılığıyla banka hesabından çekilen tutarın mutabakatı ekli banka dekontu ekteki hesaba gönderildi ek ücret ödendi ödenecek ek mektubun miktarına bakın gönderilen borç ödendi bakın ekteki form hala ödenmemiş kredi bürosu hesabının hala borçlu olduğunu belirtiyor. Teklif edilen miktar tahliye edildi. Kavga etmek. Equifax reddedildi. Ekteki anlaşmazlığa bakın.
41,credit_reporting,"kredi çekildi borç veren bir ev kredisi almaya hazırlanıyor borç veren rapor ettikten sonra rahatsız edici kredi ekstresi citi banka ödeme kartı işlemi uçak bileti konaklama sorumlusu citi banka aradı görüşme süresi citi banka talebi rahatsız edici açıklama onaylandı adres belirtilen bilgilendirilmiş belge gönderilecek çözüm için bir girişim sorunlu belgelerin citi bank'tan sözde bir çağrıdan önce gönderilmemiş olması, citi bank'ı araması, alacaklı tarafından bu tür bir aciz hakkında bilgi verilmesi, sadece borcun belirli sonucu, küçük düşürücü beyan, kredi bankası citi bank adında anlaşmazlıkta sorumluluğu reddetti, çözmeyi reddetti yönetici konuşmak istedi müdür cevapsız bir arama olması durumunda tekrar arayacağını söyledi citi'de dolandırıcılık departmanı zaman aşımını aradı anti-mosh departmanını geri çağırdı Bilgilendirilmiş müdür tahsilat için departmanı geri arayacak Bir soru sorulursa, sağlananları toplayın. departmandan bilgi anır şehir bankasını arayın aramanın süresi tahsilat departmanını arayın tahsilat departmanının bir temsilcisi s.p. Beyan edilen numara, ayrıca uygun, mevcut ev, daire numarası, ekstre, doğru protokol, daha önce gönderilen soru ile ilgili olarak Citi Bank ile iletişime geçin, birkaç kez doğrudan bildirilen üç kredi bürosuna başvurmanız gerekir, doğrudan yükümlülüğe itiraz edin. açık soruşturma talep edilen amir, gelen arama sırasında geri arayacağını bildirir konuşmanın kimliği konuşuyor yardımın zaten sağlandığını açıkladı BT mali sorumluluk hiç başlamamasına rağmen gerekli özeni gösterdi"
42,credit_reporting,merhaba ad birkaç kez iletişime geçilmeye çalışıldı sorun düzeltildi yanıt alındı ​​uzak yanlış adresler istihdam bilgileri mevcut kredi hesap yılı ek olarak aşağılayıcı bilgiler de görünüyor kredi raporu işletme adresine ait istihdam bilgilerinin silinmesi gerekiyor bilgi öncelikli hızlandırma bildirildi ar ar
43,credit_reporting,wfds şok revize edilmiş kredi raporunda geç ödeme tarihi bulundu
44,credit_reporting,eski hesabı yenilemeye devam et eski hesap bölüm hesabını ihlal ediyor fdcpa fcba cra vilates
45,credit_reporting,"İsim yanlış bilgi, adres, işletme bilgisi, ilişki bilgisi, yakın işletme, gerçekten yetenekli, kötü etki, kredi raporu, yanlış bilgi iddiası, isim, adres, işletme bilgisi değişikliği, olması gerektiği için kredi raporunu değiştirmeye çalışıyorum hemen kaldırıldı."
46,credit_reporting,ekli ilk özel yazılı beyan qwr öğesi gerekli portföy seç hizmeti sps kanıtlamak istikrarlı ipotek ödemesi makbuz olmadan tahsil etmek spss kalıcı sps kredi raporu yanlış mazeret gizliliğin ihlali fcra sps güvenli hesap aracılığıyla bağış toplama güvenli özel ipotek sps müşteri referansları birincil iş amacı hileli haciz haciz Evler
47,credit_reporting,gerçek kimlik hırsızlığı kurbanı kimlik hırsızlığı listelenmiş iki bilgiyi almaya çalıştığından beri dolandırıcılık nedeniyle isabet kaldırıldı kredi raporu görünüyor işlem yapıldı sonuç kimlik hırsızlığı da kurban veri ihlali birden fazla hesap kredi raporu mayın listelenmiş ayrıca kredi raporu dosyalandı ftc polis raporu destek talebi burada ftc rapor polis rapor numarası ive experian geçen yıl aradım dördüncü hatta arandı hesap bulunamıyor tarihi kullanarak doğrula doğum onayı experian rapor numarası hesap adı hesap numarası tarih açılan hesap adı hesap numarası hileli borç kredi başvurusunu engelliyor hatta ilk kez kredi kartı alıyor insanlar kredi oluşturmaya çalışmak bil bir sonraki adıma başla çözüme git durum finansal duygusal strese neden oldu en kötü kısmı işe dayalı bilgi verilmedi reddetme raporu konusu CRA raporlarıyla ilgili olumsuz eylem yanlış bilgi sonucu dolandırıcılık kurbanı hırsızlık yeri dolandırıcılık uyarısı kredi raporu Ayrıca dosya ilçe şerifinin ofisine bir kopya polis raporu yükledim FTC raporu çok yardım için teşekkürler
48,credit_reporting,gerçek kimlik hırsızlığı kurbanı kimlik hırsızlığı bilgileri listelenmiş görünüyor kredi raporu ile ilgili işlem yapılan sonuç kimlik lütfen bilgileri engelle rapor im üye equifax veri ihlali dosyalanmış talep buna göre açık kredi girişiminde bulunma hileli madde rapor numarası dosya numarası equifax dosya numarası hesap adı hesap numarası hesap adı hesap numarası hesap adı hesap numarası hesap adı hesap numarası hesap adı hesap numarası hesap adı hesap numarası hesap adı hesap numarası hesap adı hesap numarası hesap adı hesap numarası
49,mortgages_and_loans,"kapalı ipotek dovenmuhle ipotek hesabında ödenen önemli bakiye iade için bekliyor çek hiç gelmedi denilen dovenmuhle gönderilen çek gönderilecek beklemede normal işlem hafta iş günü teslimat bekleniyor geri aradı çek asla gönderilmedi güncellenebilir yeni adres telefon e-posta posta imzalı belge güncellemek istedi posta adresi bir gün beklemesi istendi geri aradılar kontrol edildi kontrol edildi geceyi geçirmek istediler önce aradılar e-postanın artık alınmadığını söylediler sonunda iki farklı e-posta adresi buldular önce denemek istediler dediler harcadılar gece temsilci yöneticinin onaya ihtiyacı olduğunu söyledi müdürü aradılar Geri aradılar, aramaları kontrol ettiler, bir hafta içinde işleme koyulacağını belirten bir mesaj bıraktılar, arayan, geri aradı ve yöneticiden gece için bir dakika ertelemesini istedi, yöneticinin istediği her şeye neden olan bir dakika geç otomatik yoklama, geçen gün devre dışı bırakıldı waaaayyyy. para tutmak için yasadışı olarak kabul edilemez işlem"
50,mortgages_and_loans,ilk başta başarılı fargo uygula refinansman ipotek kredisi şu anda başvuruya devam et ödenmiş avans uygulanmış araştırma belgeleri kredi tamamlandı nihai karar onaylandı gelecek hafta bildirildi kredi borç geliri nedeniyle reddedildi en iyi kredi cari yılı azaltacak ipotek yılı p l daha yüksek geliri yansıtıyor şu anki nisan azalacak teşekkürler yardım
51,mortgages_and_loans,orijinal ipotek alındı ​​satıldı kredi hizmet şirket boşanmış hizmet üyesi evlilik yılı evlilik yoluyla boşanma aldı boşanma nafakası birinci yıl tam bekar anne müdahale talep etti işveren desteklenmedi kombine ani kayıp nafaka geride kaldı ipotek ödeme zorlukları başladı kredi değiştirme şirketleri hala ipotek ödemek için mücadele geldi aşağı mücadele edebilir temel onarımları karşılayabilir kombine aylık giderler yatırılan tapu değiştirme haciz sevilen ev duygusal fiziksel şu anda isteyebilir haciz kayıp iş kapalı kağıt haciz birisi faiz ifade etti ev adı komisyoncu kısa satış kredi hizmetleri işleyebilir şirket noktası kapalı derin komisyoncu komisyoncu dedi her şeyi durdurabilir kısa satış her şeyi hallederdi komisyoncu tek ko mmunicator ilgilenen emlak kredisi hizmeti açık şirket ünvanı evi kontrol et net ay git ilgilenen kişi bağlantılar diğer ilgili taraf bulundu komisyoncu devam etti sorun başlık çalışma soru noktasını tartışmak kırıldı yaz hastaneye yatırıldı ayrıca hizmet verildi depozito kağıt hastaneye yatış başladı soru komisyoncusu banka eve gitmek daha uzun adını söylemek sevk sekreter va komisyoncu satışı denemek ev iddiası aslen dosyalanmış bölge memuru tapu devredildi sekreter üniversiteye geri gitti yaz bir profesörle temasa geçti avukat komisyoncu banka son ödeme tam hesap kaydedildi temasa geçildi va dedi tapu geri devredildi kredi hizmeti şirket birisiyle iletişime geçebilir kredi hizmeti şirketi kağıt iniş alanı istedi kesin olarak bilmek istedi tamamlanan kredi transfer edildi başka bir avukat haciz teklif edildi birkaç kez avukat tedavisi işbirliği w unsch geçen yıl her ay tamamlandı kredi hizmet sağlayıcı geç ödeme bildirdi kredi mahvoldu avukat bulamıyor istekli temsil dava onarım kredisi mükemmel ödeme kredi kartı araba kredisi araba için ödendi erken kapandı iki küçük borç puanı kullan kiralama acentesi belirle e-uygunluk korku nt kısıtlama her yerde yaşar iyi kredi memuru her zaman hala geç ücretler bildirir vadesi geçmiş ödeme uzun yıllar hala haftada birkaç kez düşer fikir kredisi harap bir yıl kötü tatil eve gitmek haciz hatta kredi almak
52,mortgages_and_loans,"phh ipotek adında bir emlak vergisi mektubu suçlu alanı var para çek teminat hesabı dedi karışıklık aradı dedi geri aradı cuma aradı eskalasyon müdürü öncelik vereceğini söyledi öncelik vereceğini söyledi gerekli gerekli dosyanın bir kopyasını aldım faks varsayılanı e-posta ile vergi beyannamesi aranabilir, ilçe faks tarafından aranabilir, bırakılan başvurunun bir kopyasını e-posta ile gönderebilir, vergi beyannamesi adı verilen bir e-posta alabilir, geri gönderilebilir, e-posta adresi aranabilir, vergi beyannamesi gönderilecek. güncellemeye cevap"
53,mortgages_and_loans,"itfaiye kurtarıldı deneyimli hasar sigorta şirketi hızlı gönderdi iyi iş muayene penceresi erimiş hasarlı takip ipotek sahibi teftiş takip onaylı muayene tamamlandı baskı işi satıcı tarafından tamamlandı ödenen iş sigorta şirketi muayene gönderdi ferforje çit işi le yıkıcı satıcı her zaman geç muayene penceresini tamamladı doğrulanmış izleme ofis, emanet fonu iç hesabını izlemek istedi, her biri geri ödemeye ihtiyaç duyduğunda işlem yapmak, aileye gerekli yükü, özellikle zaman, ev borcunu koymak, ödeme süresini izlemek, emanet hesabında para saklamak, genel gider, stresli zaman, sebep, Mülk sahipliği yüzdesi göz önüne alındığında, iyi bir ödeme geçmişi."
54,mortgages_and_loans,"usps aracılığıyla alınan tarihi içeren nihai fatura nihai fatura, hasar türünü ayrıntılandıran makbuz türlerini içerir, gerekli onarım onarım bildirimini içeren fotoğraflı mekanik belgeler, yük belgesini doğrular, sorun giderme ekip sonu garanti, istenen bilgileri çevrimiçi olarak elde edin sağlanan tüketici finans şirketi sorumluluk bildirimini doğrular fatura"
55,mortgages_and_loans,"Özet Citibank ödemeyi imkansız kılıyor Gereksiz bakiyeyi kontrol et teslimat adresini veya hatta geçerli bir telefon numarasını reddet, bunun yerine geç bir ücret ekle çünkü inanılmaz bir şey görünüyor cari hesabı kontrol et artı bekleyen miktarı dene alınan teslimat adresi Citibank'ın kabaca bakiyesi Citibank bakiyesi kapalı, çevrimiçi bankacılığa erişim daha uzun süre kontrol edilebilir tam tutarı onayla hesap bakiyesini görüntülemeye devam et bakiyeyi görüntüle hesap bakiyesini görüntüle hesabı kapatmaya karar verildi aktif Citibank çevrimiçi sohbet işlevi tekrarlanan telefon görüşmesi nedeniyle başarısız oldu cari çek bakiye aktarılan kredi acenteye uygulandı bakiye ödeme limiti zaten ödenmiş Bakiye bakiyesi alakasız Notes değeri ödemesi tutar cari hesap havalesi hesap bakiyesi kapalı sokak ödemesi artık mevcut değil r cevaplar özel kredi departmanını takip edin hemen yapıldı doğrudan numara lütfen iletişime geçin satış ekibi ödemenin yönlendirilebileceğinin tamamen farkında cevaplandı çek fon banka hesabı da çek gönderin lütfen özel çevrildi numarayı belirtin numarayı belirtin menü öğesi ile ilgili görev geçti alternatif yol tekrar denendi sonunda biriyle konuşmayı başardı ama adını anlayamıyor çağrı tahsilat hesabı iptal edildi Tekrar yönlendirilen numara ayrıca gecikme ücreti eklendiğinden emin olun kredi eklendi, aradı, numarayı kaydetti, listelenen numara birkaç kez prizi engellemeye çalıştı, Citibank önemsiz borçları ödemeyi ve ne olursa olsun gecikme ücreti eklemeyi kelimenin tam anlamıyla imkansız hale getiriyor. DC, kırk yıl garanti, deyin, hiçbir şey, elbette, faturayı çevrimiçi ödemeye çalıştı, Citibank web sitesi, cevaplar, mesaj, hesap detayları, aktivite bilgileri mevcut, kapalı"
56,debt_collection,"Kiralama şirketi ""Illinois"" imzalı kira sonu kötü taşınma borçları, gönderilen hasar kanıtı, belgeler, tahsilatlar, yanıt alındı, bir ay sonra bildirim alındı, fatura, tahsilat, telefon alınmadı, ""tahsilat"" adlı posta tahsilat acentesi, beklemede Taşınma tarihi, emlak şirketinin beyanı vardır."
57,debt_collection,Alacaklılar gelir tablosu sunmayı reddediyor
58,debt_collection,"Portföy alma ortağı, birden çok günlük arama yapan yerleşik günlük arama isteği, istenen aramayı atlamak için, farklı portföyrecov arayan kimliği aranırken yardım, teşekkür ederim"
59,debt_collection,"her gün, bazen günde birkaç kez arar, bir yılın borcunu toplar, belki başkaları önemli telefon görüşmelerini bekler, her aramayı seçer, her zaman birini arar hatta bazen wo, diyelim, diyelim, diyelim, diyelim ve son kez, yoksa biri onu ciddi şekilde taciz etti, pandemi tacize birdenbire farklı günlerde birden fazla çağrı rastgele numara tacizi yanıtladı"
60,debt_collection,federal öğrenci kredisi federal vergi iadesi süreci iade stopaj mektubu federal öğrenci kredisi federal vergi iadesi süreci iade stopaj mektubunu göster eğitim departmanı eyalet iade etmeli belge hazine departmanı alındı ​​iddianame mevcudiyet telefon tipi iletişim doğrudan ihtiyaç geçmiş yıl geri ödeme çağrı numarası ödünç alınan kredi yatırım süresi çağrı geri ödeme fonu yükümlülüğü iade yılı dosya geri ödeme talebi dolandırıcılık yılı geri ödeme geri ödeme geri ödeme geri ödeme geri ödeme yılı kredi kredi almak
61,debt_collection,"Alacaklı profilini kullanan önceki işlem, tam geri ödeme şikayeti Citibank ürünü üçüncü şahıs, hırsızın eve girmesine izin verir, mali tablonun kopyası, kart girişi, elektronik bankacılık, mali bilgi yönetimini ayrı olarak gözden geçirme"
62,credit_card,"Promosyon Tarihi Üç Sayı İncele Comenity Bank Perakende Kartı Dolandırıcılık Comenity Bank Dolandırıcı Banka Kredi Kartı Sağlayıcısı Çocukların Yeri New York Sonsuza Kadar Victoria Secret Ev Kredisi Comenity Bank, Gecikmelerle Alt Limitler Almaya Başlıyor aşırı maliyet ücretleri. ayrıca kart keşif limiti de değişti aşırı ödeme gecikmesi şirket banka kredi limitini değiştireceğini söyledi ilk limite ulaşıldı, en yüksek ödeme hesabının etkilendiğini söyledi istikrarlı kredi kartı kredi notu keskin bir şekilde olumsuz düştü Şu anda borcumu ödüyorum miktar yolsuzluk borcu olumsuz etkiledi tedarik şirketi kredili mevduat hesabı çok geç ücretler ilk kredi limiti çok dalgalansa bile şirket büyük bir komisyon alıyor hesabı düzeltmek istiyorum kızgın avukat sebeplerini söyledi a bana ulaşın ben bir şirket çalışanıyım yardım isim iletişim bi ilginiz için teşekkürler"
63,credit_card,"American Express'in geçerli bir gerekçe göstermeden kredi limitini düşürdüğünü belirten sözcü, kredi limitini düşürmesinin nedeninin kredi raporunun sağlandığı gerçeğine dayanarak bakiyeyi artırmak olduğunu da sözlerine ekledi. American Express hesabındaki başarısız itibar, American Express hesabının kredi kartı üyesine erişimini uygun şekilde sağlamaya karar verdi, cfpb'nin mali düzenleyicisinin kredi itibarı, finansal kurumu bir çalışma kartı üyesine yardım etmek yerine Amerikan ticari uygulamalarının acil ihtiyaçlarını karşılamaya yardımcı olmaya teşvik etti. çabayı yansıtmak için American Express'i yaratmaya karar verdi. Bunun finansal belirsizliğe yol açabileceğini bilen birçok üye, hastalık nedeniyle işyerinin kapanması nedeniyle gelir kaybı yaşayabilir. o zaman denetçi temsilcisi iyi bir sebep sunabilir, bilgi eksikliği veya müşteri hizmetleri becerilerinin eksikliği yardımcı olabilir, ayrıca zor zamanlardan geçen müşterilerle sıkı çalışan birçok büyük finans kurumunun ihtiyaç duydukları gerçeği önceden tahmin edememiş olması da yardımcı olabilir. acilen uygun eğitim"
64,credit_card,"Pnc talebi hakkında bilgilendirilmiş kayıt promosyonu mevcut promosyon uygun pnc promosyon siparişi promosyon talebi ilgili bağlantı kullanılarak gönderilmelidir teklif belirtilen web sitesi önceki yanıt talebi gönderildi promosyon ilk kez talep kaydında promosyon bilgilendirildi um promosyon d 'bilgili kayıt önceki cevap kaydı gösteri zamanı pnc başvuru kaydı bonus teklif sunuldu evet ikinci konuşmak istiyorum hak talep et hak istirahat çete admin ilişki takım gerçekten talep iddia süresini korumak pnc başvuru kaydı yeni bilgilerin aptalca gönderilmesi nedeniyle bonus teklifi iyi sunuldu devam eden promosyon temelde geçen ayki promosyonu iddia eden diğerleri hakkında yalan söyledi devam eden promosyon size teşekkür edecek ekran görüntüleri ekli kredi karışıklığını gösterir, çünkü açık bir hesap pnc bile e-posta alır, her parayı iyi bir şekilde kaydetmenin gerekli olduğunu düşünür küçük e-posta al gelen kutusu hafızayı yenilemek için ezici bir promosyon al n hakkında teklif bulundu iş arkadaşı hak talebi udaap uyarınca başvuru ication udaap uyarınca ca kredi hesabı gerekli olduğunu kanıtla doddfrank wall street reformu iş arkadaşları zaten telefonun gerekli olduğunu söylediler bonus göster e-posta vaat edilen kanıt gönderildi başvuru e-postası üzgünüm hiçbir şey uyarı e-posta ekran görüntüsü e-posta pnc'ye pnc vereceğine söz verebilir, ancak kanıt göster, talep eden müşteri talep ettiğinde promosyon teklifine ihtiyaç duyar, gerçek teklif ayın sonunda kabul edilir, zaten nitelikli yalan ispat için başvurmak gerekir, kredi izleme yoluyla yanlış teklif, kredi izleme yoluyla bonus teklifi, bir hizmet makarası aldı en kötüsü sözde uygun teklif yalanlar udaap doddfrank sokak tüketici koruma yasası reformu"
65,credit_card,"yeni bir şikayet, dosyalama, süre, işlem, soru, kart sahipliği, saygıyla reddetme, talep etme, ayakta durma, birincisi, saygıyla, hepsi, ikincisi, kart sahipliğini onaylama, nedeni, yanıt süresi, gönderme süresi, son derece temelinde bir diğer muğlak yanıt soruşturması yürütüldü, şu ana kadar sağlanan kanıtlar, şikayet, yürütülen soruşturma, soruşturma, belge kart sahibinin borçlu olduğuna dair kanıt içeriyor, yasal, belgenin nüshası saygısızca reddedilme, ret, kalıcı kredi talep etme, ayrıca kredi bürolarına hesap bildirme, temerrüt bildirme , ayrıca devlet borcunu rapor et, rapor et, rapor al, ayrıca bir sonraki çözümü rapor et, iflası rapor et kirli bir şey tembel değil"
66,credit_card,şikayet iki ay önce gönderildi american express adresini ver müşteri hizmetleri bilgileri reddedildi birçok istek gönderildi cfpb telefon numarası yeter american express mesajını unut sorunu çöz
67,credit_reporting,va geçmiş şikayet experian kredi bürosu dahil karar verici misillemeyi durdur ayrımcılığı suistimal amerikan vergi mükellefinin erişimi bugün reddedildi experian ücretsiz yıllık kredi raporuna erişimi reddedildi kısıtlayıcı ayrımcı madde ekleyerek özellikle birçok kanıt ters eyleme tabi gerçek misillemeyi destekler experian kredi bürosu mali itibarın zarar görmesine katılmaya izin verir experian ciddi duygusal nedenlere neden olmak sıkıntıya neden olmak experian bloke yetenek incelemesi kredi raporu bu nedenle olumsuz herhangi bir rapor hasara neden oldu tam yasal sorumluluk sorumluluk experian mazeretler kısıtlamayı haklı çıkarmak web sitesi experian yerleştirmeli experian experian dahil karar verici misillemeyi durdurmalı büyük yasal sonuç ödenen yasa dışı eylem amerikalı vergi mükellefi cfpb experian yasa dışı uygulamayı araştıracak bir deneyimci kasıtlı zarar finansal itibar gerçek kanıtlanmış gerçek hasara zaten neden oldu experian kiş i lütfen experian yanıtını dikkate alın yasal şikayet experian içinde kullanıldı dahil karar verici zaman mahkeme kanun burada belirtilen mevcut durum inanç bilgi anlayış konu düzeltme tür zaman feragat olmadan yasal temsilci dava dijital olarak imzalanmış bugün cfpb'de dosyalanmıştır
68,credit_reporting,tahsilat hesabı açık hesap bakiyesi
69,credit_reporting,"birden fazla hesap reddi aldı Geçen ay talep edilen ifşa raporunun bir kopyası hiç alınmadığından, soruşturmadan sonra bir kağıt talep formu gönderildiğinden, lexis nexis bir dosya indirme bağlantısı gönderdiğini bildirdi, ancak hiçbir belge almadığı için bir sözlük raporuna bağlantı içeren bir nexislexis raporu sipariş etti dosya müşteri hizmetleri temsilcisi sürekli istek gönderir döngü istek takip asla belge göndermez lexisnexis soğuk şikayeti görmezden gelir tüketici raporu yok doğru bilgi ciddi şekilde ihlal edilmiş şirket bizim için banka hesabı bile açabilir lexisnexis sistemi"
