,product,narrative
0,credit_card,"Gönderim tarihi Sal Konu, lütfen Comenity kart perakendecisi dolandırıcılığını, merhaba, isme göre dolandırıcılığı araştırın. Childrens Place'de Comenity Bank Kredi Kartı Sağlayıcısı New York Forever Victoria Secret Orijinal Kredisi Comenity Bank Alt Limite Başladı Gecikme ücretleriyle birlikte, fazla harcama ücretleri de yakından izlenmeye başlandı ve kart açma limiti oldukça değişti Aşırı vadesi geçmiş ödeme Şirket değişeceğini söyledi banka kredisi kredi limiti, ilk limite ulaştı yukarıda bahsedilen tepe ödeme hesabı etkilendi kredi kartı kredi kartı kredi notu sert şekilde düştü kredi notu sert düştü olumsuz durum şu anda vadesi gelen tutarı ödüyorum. yolsuzluğa olumsuz etkilenen borç şirket ücreti kredili mevduat ücretleri çok geç ücretler ilk kredi limiti bile çok dalgalanıyor şirket büyük bir komisyon alıyor hesabımı düzeltmek istiyorum kızgın avukat nedenleri söyledi a benimle iletişime geçiyorum krediyi yok eden bir çalışan şirketim lütfen yardım isim iletişim bi İlginiz için teşekkür ederiz"
1,credit_card,"American Express'in geçerli bir gerekçe göstermeden kredi limitini düşürdüğünü belirten sözcü, kredi limitini düşürmesinin nedeninin kredi raporunun sağlandığı gerçeğine dayanarak bakiyeyi artırmak olduğunu da sözlerine ekledi. American Express hesabındaki başarısız itibar, American Express hesabının kredi kartı üyesine erişimini uygun şekilde sağlamaya karar verdi, cfpb'nin mali düzenleyicisinin kredi itibarı, finansal kurumu bir çalışma kartı üyesine yardım etmek yerine Amerikan ticari uygulamalarının acil ihtiyaçlarını karşılamaya yardımcı olmaya teşvik etti. çabayı yansıtmak için American Express'i yaratmaya karar verdi. Bunun finansal belirsizliğe yol açabileceğini bilen birçok üye, hastalık nedeniyle işyerinin kapanması nedeniyle gelir kaybı yaşayabilir. o zaman denetçi temsilcisi iyi bir sebep sunabilir, bilgi eksikliği veya müşteri hizmetleri becerilerinin eksikliği yardımcı olabilir, ayrıca zor zamanlardan geçen müşterilerle sıkı çalışan birçok büyük finans kurumunun ihtiyaç duydukları gerçeği önceden tahmin edememiş olması da yardımcı olabilir. acilen uygun eğitim"
2,credit_card,Pnc talebi hakkında bilgilendirilmiş kayıt promosyonu devam eden promosyon siparişi hak kazanan pnc promosyon başvurusu bağlantı kullanılarak gönderilmelidir. evet ikinci konuşmak istiyorum hak talebinde bulunun hak talebinde bulunun çete yöneticisi ilişki ekibi gerçekten hak talebinde bulunun hak talebinde bulunun süreyi koruyun uygulama pnc rekoru bonus teklifi aptalca yeni bilgiler yayınladığı için iyi sunuldu devam eden promosyon temelde geçen ay iddia eden diğerleri hakkında yalan söyledi promosyon devam ediyor devam eden promosyon ekran görüntüleri ekli krediyi göster o zamandan beri karıştır hesap aç hatta pnc e-posta al iyi kaydetmenin gerekli olduğunu düşün her küçük e-postayı al gelen kutusunu al hafızayı yenilemek için ezici promosyon al meslektaşımla ilgili teklif bulundu udaap'a göre uygulama ication ca gerekli krediyi kanıtla hesap buna göre doddfrank wall street reformu meslektaşları daha önce telefona gerekli e-posta bonusu vaat edilen kanıt gönderildi başvuru e-posta özür dilerim hiçbir şey e-posta uyarı ekran görüntüsü e-posta pnc vaat edebilir ancak kanıt göster başvuru sahibi müşteri talebinde bulunduğunda promosyon teklifine ihtiyaç var gerçek teklif ay sonunda kabul edildi zaman zaten gösterilmiş yetenekli yalan kanıt göstermeli başvuru kredi takibi yoluyla yanlış teklif kredi takibi yoluyla bonus teklifi bir hizmet makarası aldı daha kötü yalanlar reklama uygun sözde teklif udaap doddfrank wall street reformu tüketici koruma kanunu
3,credit_card,"yeni bir şikayet, gönderim, zaman, işlem, soru, kart sahipliği, saygıyla reddetme, istek, kalıcı, birinci, saygıyla, tümü, ikinci, kart sahipliğini onaylama, neden, yanıt süresi, posta zamanı, son derece belirsiz bir yanıta dayalı diğer zarf soruşturma yürütüldü, şu ana kadar sağlanan kanıtlar, iddia, yürütülen soruşturma, soruşturma, belge kart sahibinin borçlu olduğuna dair kanıt içeriyor, yasal, belgenin kopyası saygısızca reddedildi, reddedildi, kalıcı kredi başvurusu, ayrıca kredi bürolarına hesap raporu, temerrüt raporu, ayrıca devlet borç raporu, rapor et, rapor al, ayrıca bir sonraki düzeltmeyi hemen rapor et, rapor edilen iflas hiçbir şey kirli tembel insanlar"
4,credit_card,şikayet iki ay önce gönderildi american express adresini ver müşteri hizmetleri reddedildi bilgi birçok istek gönderildi telefon numarası cfpb yeterince mesajı unut american express sorunu çöz
5,credit_reporting,"va hikaye şikayet experian kredi bürosu dahil karar verici misillemeyi durdur ayrımcılığı suistimal amerikan vergi mükellefinin erişimi bugün reddedildi experian ücretsiz yıllık kredi raporuna erişimi reddedildi özellikle kısıtlayıcı ayrımcı madde ekleyerek kapsamlı kanıtlar gerçek misilleme konusunu destekler olumsuz eylem experian kredi bürosu katılıma izin verir finansal itibar hasarına neden olan experian ciddi duygusal sıkıntıya neden olmak experian engellenmiş yetenek incelemesi kredi raporu bu nedenle olumsuz herhangi bir rapor hasara neden oldu tam yasal sorumluluk experian özür kısıtlamayı haklı çıkarmak web sitesi experian kurmalı experian experian dahil karar verici misillemeyi durdurmalı büyük yasal sonuç ödenen yasa dışı eylem abd vergi mükellefi cfpb experian yanlış uygulamayı araştıracak bir experian, finansal itibara zarar verme niyetindedir. kanıtladı fiili zarar zaten yapıldı experian kiş i lütfen experian yanıtını dikkate alın yasal şikayet kullanıldı experian dahil karar verici zaman mahkeme kanunu burada belirtilen mevcut durum inanç bilgi anlayış konu düzeltme tür zaman feragat olmadan yasal temsilci dava dijital olarak bugün cfpb'de dosyalandı"
6,credit_reporting,tahsilat hesabı açık hesap bakiyesi
7,credit_reporting,"birden fazla hesap reddi aldı. Nexislexis lexisnexis raporu hakkında rapor sipariş edildi, çünkü kopya hiç alınmadı, kopya ifşası geçen ay talep edildi, araştırmadan sonra gönderilen kağıt talep formu lexis nexis raporları yayınlandı indirme bağlantısı ama asla lexis nexis hiçbir şey almıyor çoğu zaman lexis nexis bir dosya aramayı reddediyor müşteri hizmetleri temsilcisi sürekli yapar bir istek istek döngüsü takibi asla bizimle bir banka hesabı almak için belge göndermez lexisnexis sistemi"
8,credit_reporting,isim son dört s yaz xxxxmy hesap numarası anlaşmazlık geç ödeme bildirildi kohl hastane etkilenen uzun süre iş kaybı kohl tavsiye edilen ödeme gecikmeli alındı ​​kredi uyarısı geç ihlal bildirildi hemşirelik kanunu geç ödeme ödendi kaldırıldı kaldırıldı hesabı tam kredi raporu hatalı geç ücreti kaldır dedi koruma sağlandı nafaka sorumlu değil önerilen kohl ertelenmiş plan adı verilen yazılı bir bildirim aldı onay aracısı dedi ki sağlık korumalı kohl bakım önlemi onarım kredi raporu geç ödeme çağrısı yapılan hesap olumsuz söylenti tahmini hesap kredi limiti belirleyecek yasa dışı kredi harap udapp ihlali bakım ihlali eylem
9,credit_reporting,"ödemeyi kredi kartı ile yapan müşteri adına kayıtlı mutabakat sözleşmesinin ekine bakın tam tebligat alındı ​​banka hesabından çekilen tutarın tamamı ödenmiş hesap sözleşmesinin ekine bakın ekli banka dekontu ile banka hesabından çekildi ekli hesap için ödenen ek ücret bkz. Ekli formda, kredi bürosunun ödenmemiş hesabının hala vadesinin geldiği belirtilmektedir. Teklif edilen miktar geri ödendi. Kavga etmek. Equifax reddedildi. Ekteki anlaşmazlığa bakın."
10,credit_reporting,"kredi çekilen borç veren ev satın alma kredi talebini borç veren bildirdikten sonra hazırlıyor saldırgan beyanı kredi citi banka ödeme kartı işlemi uçak bileti konaklama süpervizörü aradı citi banka aradı çağrı süresi citi banka talebi saldırgan beyanı onaylanmış adres sağlandı bilgilendirilmiş belge gönderiliyor sorunu çözmeye çalışıyor belgeler gönderilmeden önce hiç çağrılmadı Citi Bank arama süresi, citi bankada arama, alacaklı tarafından talep çözülebilir, benzer bir iflas başvurusu hakkında bilgilendirilir, yalnızca belirli bir borç sonucu, küçük düşürücü beyan, adı geçen bir kredi citi bankasının sorumluluğu reddedildi anlaşmazlıkta sorumluluk reddedildi yöneticiyi çözmeyi reddetti konuşmak istedi müdür cevapsız geri aradığını söyledi cevapsız geri arama Citi Bank dolandırıcılık departmanı aradı Citi Bank bankayı aradı Moshe önleme departmanı geri aradı Bilgilendirilmiş müdür tahsilat departmanını geri arar Soru sorulduğunda verilen bilgileri toplar departman oluşumu anır şehir bankasını aradı çağrı süresi borç tahsilat departmanı borç tahsilat departmanı temsilcisini aradı s.p. Beyan edilen numara, ayrıca uygun, mevcut ev, apartman numarası, faturalandırma, doğru protokol, daha önce sorulan soru aracılığıyla Citi Bank ile iletişime geçin, doğrudan sorumluluğa itiraz etmek için doğrudan bildirilen üç kredi bürosuyla birkaç kez iletişime geçmek gerekir. Açık soruşturma istendi Süpervizör, gelen arama sırasında geri arayacağını bildirdi Çağrının süresi konuşuldu Çalışan kimliği, yardımın zaten sağlandığını belirtti BT personeli mali sorumluluk hiçbir zaman başlamamasına rağmen gerekli özeni gösterdi"
11,credit_reporting,merhaba isim birkaç kez iletişime geçmeye çalıştı sorun düzeltildi cevap alındı ​​kaldırıldı yanlış adres istihdam bilgileri kredi hesabının cari yılı ek rahatsız edici bilgiler görünüyor kredi raporu istihdam bilgileri iş adres bilgileri bilgileri silmeniz gerekiyor öncelikli hızlandırma bildirildi ar ar
12,credit_reporting,şok gözden geçirilmiş kredi raporunda geç ödeme tarihi bulundu wfds
13,credit_reporting,"Eski hesabı güncellemeye devam edin Eski hesap, bölüm hesabını ihlal ediyor fdcpa fcba cra vilates"
14,credit_reporting,"İsim yanlış bilgi, adres, işletme bilgisi, ilişki bilgisi, yakın işletme, gerçekten yetenekli, kötü etki, kredi raporu, yanlış bilgi iddiası, isim, adres, işletme bilgisi değişikliği, olması gerektiği için kredi raporunu değiştirmeye çalışıyorum hemen kaldırıldı."
15,credit_reporting,ekli ilk özel yazılı başvuru qwr öğesi gerekli portföy seç hizmeti sps kanıtlıyor istikrarlı ipotek ödemesini makbuz olmadan tahsil et spss ayakta sps kredi raporu yanlış bahane mahremiyetin ihlali fcra sps Güvenli hesap aracılığıyla para toplama güvenli özel ipotek sps müşteri incelemeleri ana iş hedefi hileli haciz eve el koyma
16,credit_reporting,"kimlik hırsızlığının gerçek kurbanı çünkü kimlik hırsızlığı iki bilgi almaya çalıştı listelenmiş dolandırıcılık isabet kaldırıldı kredi raporu işlem yapıldı sonuç kimlik hırsızlığı ayrıca kurban veri ihlali birden fazla hesap için kredi raporu mayın listelenmiş ayrıca kredi raporu dosyalandı ftc polis raporu destek talebi burada ftc raporu polis raporu geçen yıl experian'ı aradığım numara. Dördüncü hattan aradım. Hesap bulunamadı. Doğum tarihine göre doğrulayın, çözüme yönelik bir sonraki adımın başladığını bilin, durumun finansal duygusal sıkıntıya neden olduğu en kötü kısım işle ilgili bilgiler sağlanmadı rapor reddetme CRA raporlarına karşı olumsuz eylem yanlış bilgilendirme sonucu dolandırıcılık kurbanı hırsızlık yeri dolandırıcılık uyarısı kredi raporu da ilçe şerifinin ofisine şikayette bulunun i Opya'nın polis raporunu yükledi. FTC raporu. yardım için çok teşekkürler"
17,credit_reporting,Gerçek Kimlik Hırsızlığı Mağdurun Kimlik Hırsızlığı Bilgileri Listelenmiştir Kredi İşlemi Sonucu Kimlik Blok Bilgileri Raporu Üyelik Equifax Veri İhlal Başvurusu Sonuç Olarak Gönderilmiştir Açık Kredi Girişimi Dolandırıcılık Madde Numarası Rapor Numarası Dosya Numarası Equifax Dosya Numarası Hesap Adı Hesap Numarası Hesap Adı Hesap Numarası Hesap Adı Hesap Numarası Hesap Adı Hesap Numarası Hesap Adı Hesap Numarası Hesap Adı Hesap Numarası Hesap Adı Numarası hesap adı hesap numarası hesap adı hesap numarası
18,mortgages_and_loans,kapalı ipotek dovenmuhle ipotek hesabında ödenen önemli bakiye iade için bekliyordu Çek hiç gelmedi dovenmuhle aradı çekin gönderileceğini söyledi normal işlem hafta iş günü nakliye çağrı bekliyor iade çeki asla gönderilemiyor yeni adres gönderilebilir telefon e-posta e-posta imzalı belge güncelleme istiyor posta adresi bir gün beklemesi istendi geri arama doğrulandı geceyi geçirmek istedi kabul edildi başlangıçta arandı dedi e-posta bir daha asla alınmadı iki farklı e-posta adresi nihayet bulundu dedi ilk denemek istedi geceyi geçirdi sözcü menajerin onaya ihtiyacı olduğunu söyledi menajeri aradı aradı geri aradı çek geri aradığı hafta içinde işlenecek bir mesaj bıraktı yöneticiden geri aradığı gece için bir dakika geç kalmasını istedi hepsi sor yönetici bir dakika gecikme otomatik arama devre dışı waaaayyyy ertesi gün pencere geri garanti tam işlemi yasadışı olarak para tutmak için kabul edilemez
19,mortgages_and_loans,ilk başarıyla uygula fargo refinance ipotek kredisi devam et başvuru şimdi ödendi ön ödeme uygulandı araştırma kredisi tamamlandı nihai karar onaylandı gelecek hafta kredi borç geliri nedeniyle reddedildi en iyi kredi cari yılı azaltacak ipotek yılı p l daha yüksek geliri yansıtacak cari nisan düşecek teşekkürler yardım
20,mortgages_and_loans,orijinal ipotek alındı ​​satıldı kredi hizmet şirket boşanmış hizmet üyesi yıllar evlilik ev üzerinden boşanma aldı boşanma nafaka aldı tam ilk yıl bekar anne müdahale talep etti işveren desteksiz kombine ani kayıp nafaka ödemesi geride kaldı ipotek ödeme zorluğu başladı kredi değiştirme şirket hala ipotek ödemede zorluk düştü mücadele temel onarımı karşılayabilir birleşik aylık masraf mülk dosyalanmış tapu ikame haciz evi duygusal olarak sevildi şimdi doğru şeyi isteyebilir haciz kaybedilen iş tamamlandı kağıt haciz birisi yaklaştı faiz ev adı komisyoncu kısa satışla ilgilenebilir kredi hizmeti şirket noktası kapalı derin komisyoncu komisyoncu dedi her şeyi durdurabilir kısa satış her şeyin icabına bakardı komisyoncu tek iletişimci oldu ilgilenen emlak kredisi hizmeti net şirket unvanı kontrol evi net ay git ilgilenen kişi ilgili başka bir taraf bıraktı komisyoncu devam etti sorun başlık çalışma soruyu tartışmak noktada kırıldı yaz hastaneye kaldırıldı ayrıca hizmet verildi haciz kağıt hastaneye yatış başladı soru komisyoncusu banka eve daha uzun isim söylemek transfer sekreter va komisyoncu satmaya devam etmeye çalış ev iddia orijinal dosyalanmış ilçe katip tapu transfer sekreter üniversiteye geri gitti yaz bir profesör avukat komisyoncu bankayla son ödeme yapıldı hesabın tamamı kaydedildi temasa geçildi va dedi tapu geri devredildi kredi hizmeti şirket birisiyle iletişime geçebilir kredi hizmeti şirketi bilmek istedi kağıt konşimento kesin olarak bilmek istedi arandı tamamlandı kredi başka bir avukata yönlendirildi haciz teklif edildi avukat tedavi işbirliği arzusu geçen yıl her ay tamamlandı kredi hizmet şirketi geç ödeme bildirdi kredi mahvoldu avukat bulamıyor istekli temsil dava onarım kredi mükemmel ödeme kredi kartı araba kredisi ödenen araba erken kapandı iki küçük borç puanı kullan kiralama acentesi e uygunluk korkusu nth kısıtlama canlı her yerde iyi kredi memuru hala geç ücretleri rapor ediyor vadesi geçmiş ödeme uzun yıllar tahakkuk ediyor hala haftada birkaç kez temasa geç fikir kredisi yok edilmiş yıl daha kötü izin eve gitmek haciz hatta kredi almak
21,mortgages_and_loans,emlak vergisi suçlu mahalle phh ipotek denilen bir mektup var para çek kefalet faturası hesabı dedi dağınık aradı dedi geri aradı cuma konuştu eskalasyon müdürü sana ilk önceliği vereceğini söyledi sana ilk önceliği vereceğini söyledi gerekli nüshasını aldım varsayılan vergi beyannamesi davası faks arama e-posta ilçe faks denilen e-posta iade kopyası gönder e-posta bırakılabilir e-posta al vergi beyannamesi iade edilebilir ara e-posta adresi se vergi beyannamesi acentesi gönderebilirsiniz aranabilir covid virüs güncellemesi yapabilirsiniz hala oturum açma temsilcisi e-posta güncelleme isteği gönderdi hala güncellemeye yanıt veriyor
22,mortgages_and_loans,yangın evi kurtarıldı deneyimli hasar sigorta şirketi gönderdi hızlı iyi iş çek pencere sigortalı hasarlı izleme banka çek ipotek sahibi takip ediyor onaylı çek tamamlandı yazdırma işi tamamlandı satıcı ödenen iş sigorta şirketi ofis çek gönderildi çek sahte kol demir imha gerekli depozito yazarkasa dahili hesap ne zaman birisi işlem yap gerekli geri ödeme gerekli masrafı koy aile özel zamanı borç ev takibi ödeme zamanı para garantili hesap ayarla genel stres zaman oranı verilen mülk sahiplik oranı iyi ödeme geçmişi
23,mortgages_and_loans,"nihai fatura, usps aracılığıyla alınan tarih dahil olmak üzere, nihai fatura, hasar türünü ayrıntılandıran destekleyici belgelerin türünü, gerekli onarım dahil olmak üzere fotoğraflı mekanik belgeleri, onarım bildirimini, şarj belgesini, sorun gidermeyi, ekipmanın nihai sonucunu doğrular, alabileceğiniz garantiyi içerir istenen bilgiler çevrimiçi, tüketici, finans şirketi. sağlanan sorumluluk bilgileri faturayı doğrular"
24,mortgages_and_loans,"Özet citibank ödemeyi imkansız kılıyor citibank ödemeyi reddetmeyi kontrol et teslimat adresini kontrol et ve hatta geç ücretler eklemek yerine geçerli telefon numarasını kontrol et bakiye online bankacılık erişimi kesin miktarı onayla hesap bakiyesini daha büyük hesap bakiyesini görüntüle karar çek hesabı kontrol et aktif online sohbet citibank İşlev Başarısız tekrar telefon görüşmesi nedeniyle Notes değeri ödeme tutarı havale cari hesap Bakiye kapalı ödeme hesabı yolda artık mevcut değil r cevaplar özel bölümü takip edin kredi yapıldı hemen numara lütfen tam satış birimiyle iletişime geçin ödemenin iletilebileceğini bil banka hesabını kontrol et ayrıca çek gönder lütfen özel ara numarayı ayarla ilgili menü seçeneği yok ilgili çalış alternatif rota dene tekrarla tahsilat hesabının adını anlıyor çağrı iptal çağrı Yönlendirilen numara tekrar emin olun ayrıca geç kredi tahsilat arzı denilen çağrı saklama numarası bu numara defalarca denendi çıkmaza girdi. DC, kırk yıl garanti, deyin, hiçbir şey, kesin, faturayı online ödemeye çalıştım, Citibank web sitesi, cevaplar, mesaj, hesap detayları, aktivite bilgisi mevcut, kapalı"
25,debt_collection,"Kiralama şirketi ""Illinois"" imzalı kira sonu kötü taşınma borçları, gönderilen hasar kanıtı, belgeler, tahsilatlar, yanıt alındı, bir ay sonra bildirim alındı, fatura, tahsilat, telefon alınmadı, ""tahsilat"" adlı posta tahsilat acentesi, beklemede Taşınma tarihi, emlak şirketinin beyanı vardır."
26,debt_collection,Alacaklılar vergi beyannamesi vermeyi reddediyor
27,debt_collection,"Portföy Kurtarma İş Ortağı, istenen aramayı yok saymak için yerleşik günlük arama isteğinde birden fazla günlük arama yapar, lütfen farklı bir arayan kimliği numarası ararken yardımcı olun portföyrecov teşekkür ederim"
28,debt_collection,her gün bazen günde birkaç kez arıyor bir yılın borcunu tahsil ediyor belki diğerleri önemli telefon görüşmeleri bekliyor her aramayı seç her zaman birisini al bazen wo bile söyle ca söyle ca söyle ca en son birisi ona ciddi şekilde taciz etmedikçe pandemi yanıt verdi taciz tacize farklı günlerde birden çok kez arama rastgele sayı tacizi
29,debt_collection,federal öğrenci kredisi federal vergi iadesi süreci iade stopaj mektubu tamamlandı federal öğrenci kredisi federal öğrenci kredisi geri ödeme süreci iade stopaj mektubunu göster eğitim bakanlığı eyalet iade etmeli belge hazine alındı ​​iddianame müsaitlik telefon tipi doğrudan geri ödeme ihtiyacı geçen yıl telefon numarası ödünç alınan kredi yatırım süresi arama kurtarma fonu yükümlülüğü geri ödeme yılı itfa için dava dolandırıcılık yıl haciz itfa itfa itfa itfa itfa yıl kredi kredi almak
30,debt_collection,ihbarcı alacaklı profilini kullanan geçmiş işlem tamamen iade edilen ürün iade citibank üçüncü şahıs hırsızın ara eve girmesine izin verir mali beyanı kopyala kart girişe izin ver online bankacılık gözden geçirme finansal bilgileri ayrı yönet
31,credit_card,"Gönderim tarihi Sal Konu, lütfen Comenity kart perakendecisi dolandırıcılığını, merhaba, isme göre dolandırıcılığı araştırın. Childrens Place'de Comenity Bank Kredi Kartı Sağlayıcısı New York Forever Victoria Secret Orijinal Kredisi Comenity Bank Alt Limite Başladı Gecikme ücretleriyle birlikte, fazla harcama ücretleri de yakından izlenmeye başlandı ve kart açma limiti oldukça değişti Aşırı vadesi geçmiş ödeme Şirket değişeceğini söyledi banka kredisi kredi limiti, ilk limite ulaştı yukarıda bahsedilen tepe ödeme hesabı etkilendi kredi kartı kredi kartı kredi notu sert şekilde düştü kredi notu sert düştü olumsuz durum şu anda vadesi gelen tutarı ödüyorum. yolsuzluğa olumsuz etkilenen borç şirket ücreti kredili mevduat ücretleri çok geç ücretler ilk kredi limiti bile çok dalgalanıyor şirket büyük bir komisyon alıyor hesabımı düzeltmek istiyorum kızgın avukat nedenleri söyledi a benimle iletişime geçiyorum krediyi yok eden bir çalışan şirketim lütfen yardım isim iletişim bi İlginiz için teşekkür ederiz"
32,credit_card,"American Express geçerli bir gerekçe göstermeden kredi limitini düşürdü, önceden haber verdi, temsilci kredi limitinin düşürülmesinin nedeninin bakiyedeki artıştan kaynaklandığını belirtti gerçeğe dayanarak, kredi raporu sağlandı. American Express hesabında iyi itibar başarısız oldu kredi kartı üyesine erişmek için American Express hesabına düzgün bir şekilde bakmaya karar verdi, birinin kredibilitesi cfpb mali düzenleyicisi, finansal kurumu müşterinin acil ihtiyaçlarını karşılamaya yardımcı olmaya teşvik etti American Express iş uygulamaları, bir çalışma kartı üyesine yardım etmek yerine çabaları yansıtmak için American Express oluşturmaya karar verdi. Bunun finansal belirsizliğe yol açabileceğini bilerek, birçok üye hastalık nedeniyle işyerinin kapanması nedeniyle gelir kaybıyla karşı karşıya kalabilir. o zaman denetçinin temsilcisi iyi bir neden sunabilir, bilgi eksikliği müşteri hizmetleri becerilerinin eksikliği yardımcı olabilir, ayrıca zor zamanlardan geçen müşterilerle sıkı çalışan birçok büyük finans kurumunun acilen uygun eğitime ihtiyaç duyduğu gerçeğini sağlayamadı"
33,credit_card,"Pnc talebi hakkında bilgilendirilmiş kayıt promosyonu mevcut promosyon uygun pnc promosyon siparişi promosyon talebi ilgili bağlantı kullanılarak gönderilmelidir teklif belirtilen web sitesi önceki yanıt talebi gönderildi promosyon ilk kez talep kaydında promosyon bilgilendirildi um promosyon d 'bilgili kayıt önceki cevap kaydı gösteri zamanı pnc başvuru kaydı bonus teklif sunuldu evet ikinci konuşmak istiyorum hak talep et hak istirahat çete admin ilişki takım gerçekten talep iddia süresini korumak pnc başvuru kaydı yeni bilgilerin aptalca gönderilmesi nedeniyle bonus teklifi iyi sunuldu devam eden promosyon temelde geçen ayki promosyonu iddia eden diğerleri hakkında yalan söyledi devam eden promosyon size teşekkür edecek ekran görüntüleri ekli kredi karışıklığını gösterir, çünkü açık bir hesap pnc bile e-posta alır, her parayı iyi bir şekilde kaydetmenin gerekli olduğunu düşünür küçük e-posta al gelen kutusu hafızayı yenilemek için ezici bir promosyon al n hakkında teklif bulundu iş arkadaşı hak talebi udaap uyarınca başvuru ication udaap uyarınca ca kredi hesabı gerekli olduğunu kanıtla doddfrank wall street reformu iş arkadaşları zaten telefonun gerekli olduğunu söylediler bonus göster e-posta vaat edilen kanıt gönderildi başvuru e-postası üzgünüm hiçbir şey uyarı e-posta ekran görüntüsü e-posta pnc'ye pnc vereceğine söz verebilir, ancak kanıt göster, talep eden müşteri talep ettiğinde promosyon teklifine ihtiyaç duyar, gerçek teklif ayın sonunda kabul edilir, zaten nitelikli yalan ispat için başvurmak gerekir, kredi izleme yoluyla yanlış teklif, kredi izleme yoluyla bonus teklifi, bir hizmet makarası aldı en kötüsü sözde uygun teklif yalanlar udaap doddfrank sokak tüketici koruma yasası reformu"
